25::::The Oxford and Cambridge University Boat Race::::1895-03-30::::https://m.media-amazon.com/images/M/MV5BOGFiZjVkYmYtYjkwZC00NWY0LWI0MGItYWYyNzNlMDNlN2Y2XkEyXkFqcGdeQXVyNzg5OTk2OA@@._V1_.jpg::::Although the content of this film is primitive in the extreme - a shot of the traditional Oxford versus Cambridge University Boat Race, filmed on March 30 1895 - this film is of immense historical importance as being the first ever British film
0102996::::Strictly Business::::1991-11-08::::http://image.tmdb.org/t/p/w500//aH8NjAzgxQckbt1oY4YBpCYLrDd.jpg::::Waymon has a great job in real estate and a promising future, but he's also trapped in a loveless longterm relationship. He meets Natalie, a beautiful club-hopping hipster, and quickly falls in love. Realizing he's just not cool enough to attract her on his own, he seeks the help of his friend Bobby, a free-spirited smooth talker who works in the mail room at Waymon's firm and utilizes the predicament as leverage to advance in the company.
0103035::::Taking Care of Business::::1990-08-16::::http://image.tmdb.org/t/p/w500//yVs2wx0BuCbxB2fOraUFVxI4oZK.jpg::::An uptight advertising exec has his entire life in a filofax organizer which mistakenly ends up in the hands of a friendly convict who poses as him.
0103060::::Teenage Mutant Ninja Turtles II: The Secret of the Ooze::::1991-03-22::::http://image.tmdb.org/t/p/w500//Hyvvz9Z3le1is8a0EeFJQm0aSC.jpg::::The Turtles and the Shredder battle once again, this time for the last cannister of the ooze that created the Turtles, which Shredder wants to create an army of new mutants.
0103243::::Where Angels Fear to Tread::::1991-06-21::::http://image.tmdb.org/t/p/w500//kmkmwHi5rxn605EbOm67OITL7eX.jpg::::An English widow goes to Italy, falls in love with a dentist's son and marries him, against her straitlaced family's wishes.
0103634::::Aileen Wuornos: The Selling of a Serial Killer::::1992-11-01::::http://image.tmdb.org/t/p/w500//zOC24dXsHUQDF4H42iMuYEDgOta.jpg::::Aileen Wuornos: The Selling of a Serial Killer (1993) is a documentary film about Aileen Wuornos, made by Nick Broomfield. It documents Broomfield's attempts to interview Wuornos, which involves a long process of mediation through her adopted mother Arlene Pralle and lawyer, Steve Glazer.
0103855::::The Bodyguard::::1992-11-25::::http://image.tmdb.org/t/p/w500//2VgZW2ZD3pNoV2j8U2GXNRwOsk9.jpg::::A former Secret Service agent grudgingly takes an assignment to protect a pop idol who's threatened by a crazed fan. At first, the safety-obsessed bodyguard and the self-indulgent diva totally clash. But before long, all that tension sparks fireworks of another sort, and the love-averse tough guy is torn between duty and romance.
0103882::::A Brief History of Time::::1991-10-01::::http://image.tmdb.org/t/p/w500//suzXlM1q3L4tS29pWvYomAbFn6c.jpg::::The story of the extraordinary life of eminent scientist, Steven Hawking. As he goes through school, and despite being diagnosed with ALS, Hawking develops revolutionary theories about time, black holes, and the origin of the universe.
0103888::::Brother's Keeper::::1992-09-09::::http://image.tmdb.org/t/p/w500//AjumCYR6VPXGDKlYekGkx5jMdfi.jpg::::This documentary by Joe Berlinger and Bruce Sinofsky details the murder trial of Delbert Ward. Delbert was a member of a family of four elderly brothers, working as semi-literate farmers and living together in isolation from the rest of society until William's death.
0103893::::Buffy the Vampire Slayer::::1992-07-24::::http://image.tmdb.org/t/p/w500//so4tTMItoq90wphs18lWbV0ASVV.jpg::::Blonde, bouncy Buffy is your typical high school cheerleader: her goal is to "marry Christian Slater and die," and nothing gets in her way when it's time to shop! But all that changes when a strange man informs her she's been chosen by fate to kill vampires.  With the help of a romantic rebel, Buffy is soon spending school nights protecting L.A. from Lothos the Vampire King, his sidekick, Lefty, and their determined gang of bloodsuckers. It's everything you'd expect from a teen queen in the Valley.
0103923::::Captain America: Civil War::::2016-04-27::::http://image.tmdb.org/t/p/w500//rAGiXaUfPzY7CDEyNKUofk3Kw2e.jpg::::Following the events of Age of Ultron, the collective governments of the world pass an act designed to regulate all superhuman activity. This polarizes opinion amongst the Avengers, causing two factions to side with Iron Man or Captain America, which causes an epic battle between former allies.
0103957::::Children Of The Night::::1991-09-06::::http://image.tmdb.org/t/p/w500//bjJsMXhGMCnzcqmM93Jy3LEEhDG.jpg::::Cindy and Lucy are eighteen and going away to college. As a ritual they must rid themselves of the dirt of their small home town (Allburg) by swimming in an abandoned church crypt. They jump in and begin talking about sex when Lucys crucifix falls into the water and drifts down to land on Czakyr's (an ancient vampire) head, apparently waking him up. Some time onwards a school teacher from a nearby town, Mark, gets directed to Allburg to help Lucy and her grandmother, who are suspected to be in trouble. Lucy becomes the target of a town turned vampire because of her 'virgin blood'. Mark, Lucy and an old wino shack up in an abandoned building outside of town but eventually get lured back to Allburg by the locals. There, with a giant glowing cross spearing the front of their Toyota, they take the town on and battle Czakyr.
0104254::::FernGully: The Last Rainforest::::1992-04-10::::http://image.tmdb.org/t/p/w500//Z4XMgqIY6yT6QpoBISIlHzh8ol.jpg::::When a sprite named Crysta shrinks a human boy, Zak, down to her size, he vows to help the magical fairy folk stop a greedy logging company from destroying their home: the pristine rainforest known as FernGully. Zak and his new friends fight to defend FernGully from lumberjacks — and the vengeful spirit they accidentally unleash after chopping down a magic tree.
0104291::::Forever Young::::1992-12-16::::http://image.tmdb.org/t/p/w500//1emjW7UqtVWsn6P6YPg8NFNnmen.jpg::::A 1939 test pilot asks his best friend to use him as a guinea pig for a cryogenics experiment. Daniel McCormick wants to be frozen for a year so that he doesn't have to watch his love lying in a coma. The next thing Daniel knows is that he's been awoken in 1992.
0104348::::Glengarry Glen Ross::::1992-09-15::::http://image.tmdb.org/t/p/w500//zcaEDx8KlVfh4vKfMNLhiSi5Oz4.jpg::::When an office full of Chicago real estate salesmen is given the news that all but the top two will be fired at the end of the week, the atmosphere begins to heat up. Shelley Levene, who has a sick daughter, does everything in his power to get better leads from his boss, John Williamson, but to no avail. When his coworker Dave Moss comes up with a plan to steal the leads, things get complicated for the tough-talking salesmen.
0104389::::The Hand that Rocks the Cradle::::1992-01-10::::http://image.tmdb.org/t/p/w500//8Ktj8PuupTIFIUIiuOqxfKKg2c2.jpg::::A suburban family chooses seemingly sweet Peyton Flanders as their newborn's nanny. Only much later does the infant's mother, Claire Bartel, realize Peyton's true intentions -- to destroy Claire and replace her in the family. The nail-biting suspense builds quickly in this chilling psychological thriller about deception and bitter revenge.
0104409::::Hellraiser III: Hell on Earth::::1992-09-11::::http://image.tmdb.org/t/p/w500//6gQGP4JEVXZcz1tANNF0h9e7tqc.jpg::::Pinhead is trapped in a sculpture and fortunately for him the sculpture is bought by a young playboy who owns his own night club. Pinhead busies himself escaping by getting the playboy to lure victims to his presence so he can use their blood. Once free, he seeks to destroy the puzzle cube so he need never return to Hell, but a female reporter is investigating the grisly murders and stands in his way.
0104418::::Highway to Hell::::1991-11-21::::http://image.tmdb.org/t/p/w500//lGSHsgA65wZW485bL1g2q2fF4JI.jpg::::Charlie and Rachel run away from home to get married in Las Vegas. But they get attacked by a zombie who takes Rachel with him to hell, where she will become one of Satan's brides
0104431::::Home Alone 2: Lost in New York::::1992-11-19::::http://image.tmdb.org/t/p/w500//uuitWHpJwxD1wruFl2nZHIb4UGN.jpg::::Instead of flying to Florida with his folks, Kevin ends up alone in New York, where he gets a hotel room with his dad's credit card—despite problems from a clerk and meddling bellboy. But when Kevin runs into his old nemeses, the Wet Bandits, he's determined to foil their plans to rob a toy store on Christmas eve.
0104511::::Innocent Blood::::1992-09-25::::http://image.tmdb.org/t/p/w500//ikYJfzLcIaDttliXFSgjhhiUAj5.jpg::::A beautiful vampire turns a crime lord into a creature of the night.
0104522::::Into the West::::1992-10-23::::http://image.tmdb.org/t/p/w500//k9e63dUNxu5MtXCCB3trUXtXX58.jpg::::Accused of a crime they didn't commit, two city kids and a magical horse are about to become the coolest outlaws ever to ride Into The West.
0104575::::Just Another Girl on the I.R.T.::::1993-01-01::::http://image.tmdb.org/t/p/w500//jjBthOisXwuyUqBd1BAmIzdSf4S.jpg::::Chantel Mitchell, a hip, articulate, black high-school girl in Brooklyn, is determined not to become "just another girl on the IRT" (the IRT is one of NYC's subway lines). She dreams of medical school, a family, and an escape from the generational poverty and street-corner life her friends seem to have accepted as their lot. But personal and sexual challenges confront Chantel on her way to fulfilling these dreams.
0104691::::The Last of the Mohicans::::1992-09-25::::http://image.tmdb.org/t/p/w500//fYVQRcgnOv998bKEplzrD3faGgt.jpg::::As the British and French soldiers battle for control of the American colonies in the 18th century, the settlers and native Americans are forced to take sides. Cora and her sister Alice unwittingly walk into trouble but are reluctantly saved by Hawkeye, an orphaned settler adopted by the last of the Mohicans.
0104692::::The Lawnmower Man::::1992-03-05::::http://image.tmdb.org/t/p/w500//dTQT56fAfjKCcMXXgWc8waRc3n9.jpg::::A simple man is turned into a genius through the application of computer science.
0104695::::Leap of Faith::::1992-12-18::::http://image.tmdb.org/t/p/w500//qyViA0IPaQW8PekBZotxl7WXjK8.jpg::::Jonas Nightengale is a fraudulent Christian faith healer who makes a living travelling around America holding revival meetings and conducting 'miracles' with the help of his friend and manager, Jane, and their entourage. One of their trucks breaks down in Rustwater, a town in desperate need of rain to save their crops. While waiting for spare parts, Jonas decides to hold a revival meeting in the town. The local sheriff, Will Braverman, is skeptical and tries to prevent his town and its people from being conned. However a local disabled boy, Boyd, believes Jonas could make him walk again. Events in Rustwater make Jonas examine his own faith and doubts.
0104745::::The Living End::::1992-08-21::::http://image.tmdb.org/t/p/w500//lH1UXIVibg5i8gcZeIfDHDxk2Kc.jpg::::Luke is a gay hustler. Jon is a movie critic. Both are HIV positive. They go on a hedonistic, dangerous journey. Their motto: "Fuck the world".
0104753::::The Long Day Closes::::1992-05-22::::http://image.tmdb.org/t/p/w500//19ggXBxVQgmhTlEo4yplPaYg76k.jpg::::Set in Kensington, a working-class district of Liverpool, England in mid-1950s, this is the story of eleven-year-old Bud, a sad and lonely boy. With cinema as his main source of solace, he haunts the local 'picture-house'. All the while, his family looms large in our peripheral vision as do the menacing bullies of his school, but Bud is the centre of attention both from the camera's angle and from his doting family.
0104759::::The Lost World::::2001-12-25::::http://image.tmdb.org/t/p/w500//22PtJeHtI19j15nkQiM561Ng7cH.jpg::::This Lost World is a splendid BBC TV dramatisation of Sir Arthur Conan Doyle's famous adventure story. Bob Hoskins makes an unusually genial Professor Challenger, far less of a bully than Doyle's character, but his slightly stereotyped companions are nicely filled out by a solid cast. James Fox is Challenger's more timid but still covertly adventurous rival, Tom Ward is the moustachioed big game hunter who faces an Allosaurus with an elephant gun, and Matthew Rhys plays the tagalong reporter hoping to impress his faithless fiancée.
0104850::::Memoirs of an Invisible Man::::1992-02-28::::http://image.tmdb.org/t/p/w500//bdhxHQNwYdjkyFx9DwebXtama0U.jpg::::After a freak accident, an invisible yuppie runs for his life from a treacherous CIA official while trying to cope with his new life.
0105046::::Of Mice and Men::::1992-09-16::::http://image.tmdb.org/t/p/w500//suX9HIS22oJf0qoZV7DUvDWtWnV.jpg::::Two drifters, one a gentle but slow giant, try to make money working the fields during the Depression so they can fulfill their dreams.
0105078::::Out on a Limb::::1992-09-04::::http://image.tmdb.org/t/p/w500//hoskwrn9imioCXxFOCf6OWoIxM5.jpg::::While heading to the town where his sister, Marci, lives, big-city banker Bill Campbell is robbed by a woman who takes everything he has, including his clothes and a business document worth millions of dollars. Bill eventually reunites with Marci, who is in a tizzy because she thinks their stepfather has been killed. While trying to determine if his sister is right, Bill must also get back his valuable paperwork.
0105112::::Patriot Games::::1992-06-04::::http://image.tmdb.org/t/p/w500//s6rjBhuGLnYqLNMdgwsjTsXbrAs.jpg::::When CIA Analyst Jack Ryan interferes with an IRA assassination, a renegade faction targets Jack and his family as revenge.
0105120::::Pensavo fosse amore invece era un calesse::::1991-12-20::::http://image.tmdb.org/t/p/w500//klLPGlWdJWqAeXJhfRyAJOYzeEd.jpg::::Tommaso goes incredible lengths to win back the love of his former girlfriend Cecilia, but sometimes things change in the most unexpected way.
0105159::::The Power of One::::1992-03-27::::http://image.tmdb.org/t/p/w500//pQMQQzWT8XBtGhIVghJiTrtzqJs.jpg::::PK, an English orphan terrorized for his family's political beliefs in Africa, turns to his only friend, a kindly world-wise prisoner, Geel Piet. Geel teaches him how to box with the motto “fight with your fists and lead with your heart”. As he grows to manhood, PK uses these words to take on the system and the injustices he sees around him - and finds that one person really can make a difference.
0105179::::Prom Night IV: Deliver Us from Evil::::1992-02-14::::http://image.tmdb.org/t/p/w500//tjq1iWClSBCfi3SjpVJblOU6q4F.jpg::::Carrying on the Prom Night tradition, this film begins back at Hamilton High School on Prom Night in 1957. As a young couple are enjoying a romantic moment together in the back seat of a car, they are interrupted by Father Jonas, a priest who slashes and immolates the lovers. Thirty years later, Jonas gets loose from the chapel basement where the church fathers had been secretly keeping him locked up and drugged. As luck would have it, it's prom night again, and group of four students have unfortunately chosen Jonas's hideout as their secluded getaway spot.
0105265::::A River Runs Through It::::1992-10-09::::http://image.tmdb.org/t/p/w500//aVP45oS2cBL4WtZ1kB7r8uarruB.jpg::::A River Runs Through is a cinematographically stunning true story of Norman Maclean. The story follows Norman and his brother Paul through the experiences of life and growing up, and how their love of fly fishing keeps them together despite varying life circumstances in the untamed west of Montana in the 1920's.
0105323::::Scent of a Woman::::1992-12-23::::http://image.tmdb.org/t/p/w500//4adI7IaveWb7EidYXfLb3MK3CgO.jpg::::Charlie Simms is a student at a private preparatory school who comes from a poor family. To earn the money for his flight home to Gresham, Oregon for Christmas, Charlie takes a job over Thanksgiving looking after retired U.S. Army officer Lieutenant Colonel Frank Slade, a cantankerous middle-aged man who lives with his niece and her family.
0105450::::South Central::::1992-09-18::::http://image.tmdb.org/t/p/w500//i1kpCAxuEeUPe9Ep8r1VUYRfSVX.jpg::::A man is put to prison for 10 years. Coming out of prison he wants to live a normal life and stop with crime but his son has yet followed the criminal path of his father.
0105665::::Twin Peaks: Fire Walk with Me::::1992-06-03::::http://image.tmdb.org/t/p/w500//fNXz8DZPmkuT9TIciEbaYy6P6yE.jpg::::In the questionable town of Deer Meadow, Washington, FBI Agent Desmond inexplicably disappears while hunting for the man who murdered a teen girl. The killer is never apprehended, and, after experiencing dark visions and supernatural encounters, Agent Dale Cooper chillingly predicts that the culprit will claim another life. Meanwhile, in the more cozy town of Twin Peaks, hedonistic beauty Laura Palmer hangs with lowlifes and seems destined for a grisly fate.
0105691::::Under Suspicion::::2000-09-24::::http://image.tmdb.org/t/p/w500//pQTNI0cui2Bg7vWhPsQjoJcY0ti.jpg::::A lawyer is asked to come to the police station to clear up a few loose ends in his witness report of a foul murder. "This will only take ten minutes", they say, but it turns out to be one loose end after another, and the ten minutes he is away from his speech become longer and longer.
0105698::::Universal Soldier::::1992-07-10::::http://image.tmdb.org/t/p/w500//fp0mWrHl1SW9PhP8QcsgYPoVYFc.jpg::::An American soldier who had been killed during the Vietnam War is revived 25 years later by the military as a semi-android, UniSols, a high-tech soldier of the future. After the failure of the initiative to erase all the soldier's memories, he begins to experience flashbacks that are forcing him to recall his past.
0105699::::Unlawful Entry::::1992-06-26::::http://image.tmdb.org/t/p/w500//sKUk1ca6gHaIopi8VqE8GoxJq6J.jpg::::After a break-in at their house, a couple gets help from one of the cops that answered their call. He helps them install the security system, and begins dropping by on short notice and unofficial patrol, and spends a lot of time discussing the couple's problems with the wife. The husband begins wondering if they're getting too much help.
0105750::::La Vie de Bohème::::1992-02-27::::http://image.tmdb.org/t/p/w500//eU2L3jp5LiZnzHqEzs3aqSRBGhI.jpg::::Three penniless artists become friends in modern-day Paris: Rodolfo, an Albanian painter with no visa, Marcel, a playwright and magazine editor with no publisher, and Schaunard, a post-modernist composer of execrable noise.
0105793::::Wayne's World::::1992-02-14::::http://image.tmdb.org/t/p/w500//rsgklbt5KxeuUuchehnLACxzisP.jpg::::When a sleazy TV exec offers Wayne and Garth a fat contract to tape their late-night public access show at his network, they can't believe their good fortune. But they soon discover the road from basement to big-time is a gnarly one, fraught with danger, temptation and ragin' party opportunities.
0105819::::Wild Orchid II: Two Shades of Blue::::1991-10-31::::http://image.tmdb.org/t/p/w500//d3r89A0iiRKhLW3SEGFIOnwExUE.jpg::::Blue is a teenage girl who lives with her Jazz playing father Ham. Ham gets very sick and dies, and now Blue must support herself somehow. Elle, the headmistress at a brothel, talks her into living and working at her establishment. She decides to leave the business and lead a normal life. Elle is hellbent to see that she never has one.
0106223::::The Adventures of Huck Finn::::1993-04-02::::http://image.tmdb.org/t/p/w500//8VpQZ43hdaTUmkMoe2CnED1Y2fS.jpg::::Climb aboard for an extraordinary version of Mark Twain's sweeping adventure when Walt Disney presents The Adventures of Huck Finn, starring Elijah Wood (The Lord of the Rings). Directed by Stephen Sommers (The Mummy, The Mummy Returns), it's the unforgettable saga of a mischievous youngster and a runaway slave
0106226::::The Age of Innocence::::1993-09-17::::http://image.tmdb.org/t/p/w500//4AZTFjb3NaRpVXQA4irlQvhfar.jpg::::Tale of 19th century New York high society in which a young lawyer falls in love with a woman separated from her husband, while he is engaged to the woman's cousin.
0106364::::Batman: Mask of the Phantasm::::1993-12-25::::http://image.tmdb.org/t/p/w500//l4jaQjkgznu2Rz05X18f24UjPNW.jpg::::Andrea Beaumont strolls back into town, rekindling an old romance with Bruce Wayne. At the same time, Batman is mistaken for a masked vigilante assassin who has begun systematically eliminating Gotham's crime bosses. Now on the run, Batman must solve the mystery, while navigating his relationship with Andrea.
0106375::::Beethoven's 2nd::::1993-12-14::::http://image.tmdb.org/t/p/w500//biH5hW1BRfEr13oCizuAzpdBf2l.jpg::::Beethoven is back -- and this time, he has a whole brood with him now that he's met his canine match, Missy, and fathered a family. The only problem is that Missy's owner, Regina, wants to sell the puppies and tear the clan apart. It's up to Beethoven and the Newton kids to save the day and keep everyone together.
0106400::::The Beverly Hillbillies::::1993-10-15::::http://image.tmdb.org/t/p/w500//refYLEQvzkY63i2IHronCPQODex.jpg::::Jed Clampett and kin move from Arkansas to Beverly Hills when he becomes a billionaire, after an oil strike. The country folk are very naive with regard to life in the big city, so when Jed starts a search for a new wife there are inevitably plenty of takers and con artists ready to make a fast buck
0106452::::Body Snatchers::::1993-06-09::::http://image.tmdb.org/t/p/w500//s8WdtuOBvfEsuPtbQVpNfEgd5aR.jpg::::When Environmental Protection Agency inspector Steve Malone travels to a remote military base in order to check for toxic materials, he brings his family along for the ride. After arriving at the base, his teenage daughter Marti befriends Jean Platt, daughter of the base's commander, General Platt. When people at the base begin acting strangely, Marti becomes convinced that they are slowly being replaced by plant-like aliens.
0106453::::Body of Evidence::::1993-01-15::::http://image.tmdb.org/t/p/w500//cwClvEmE9TbHpip2T1g3pMxF9QX.jpg::::Sizzingly sexy Madonna leads a star-filled cast in this erotic thriller as a woman accused of killing a wealthy, elderly man through her insatiable sexual prowess.
0106466::::Born Yesterday::::1950-12-25::::http://image.tmdb.org/t/p/w500//ff0r4aSlh2pNNoydCIjPvKuXKev.jpg::::Uncouth, loud-mouth junkyard tycoon Harry Brock descends upon Washington D.C. to buy himself a congressman or two, bringing with him his mistress, ex-showgirl Billie Dawn.
0106535::::The Cement Garden::::1993-02-20::::http://image.tmdb.org/t/p/w500//7bVAVixfrGcy8SeKElC8t2FynEd.jpg::::After the death of her husband, the mother of Julie, Jack, Sue and Tom begins to suffer from a mysterious illness. Aware that she is going to have to go into hospital she opens a bank account for the children, so that they can be financially self-sufficient and will be able to avoid being taken into care by the authorities. Unfortunately she also dies and Julie and Jack (the older, teenage children) decide to hide her body in the basement so that they can have free reign of their household. Soon Tom has taken to dressing as a girl whilst Sue has become increasingly reticent, confiding only to her diary, meanwhile Jack and Julie sense an attraction developing for each other. However Julie's new beau, Derek, threatens to unearth the many dark secrets within this family as he becomes increasingly suspicious of Jack.
0106557::::Children of the Corn II: The Final Sacrifice::::1992-01-29::::http://image.tmdb.org/t/p/w500//iXo8saSvSRTjis7ar98h6BduVmN.jpg::::Arriving in Gatlin, Nebraska, a news-reporter and his son get wind of a story about the youth in the town murdering their parents finds that a series of brutal murders are revealed to be worshipers of the corn-stalks and try to stop them before they carry out their plans.
0106664::::The Dark Half::::1993-04-23::::http://image.tmdb.org/t/p/w500//gALkBGt1bqdJB5LVWYdsCXFpIF6.jpg::::Thad Beaumont is the author of a highly successful series of violent pulp thrillers written under the pseudonym of ‘George Stark’, but when he decides to ‘kill-off’ his alter-ego in a mock ceremony, it precipitates a string of sadistic murders matching those in his pulp novels, which are soon discovered to be the work of Stark himself. Looking like a maniacal version of his counterpart, Stark is not so willing to quit the writing game – even if it means coming after Thad's wife and their baby.
0106677::::Dazed and Confused::::1993-09-24::::http://image.tmdb.org/t/p/w500//yJDJ2svbSHECzhr5tEV9JZTblhV.jpg::::The adventures of a group of Texas teens on their last day of school in 1976, centering on student Randall Floyd, who moves easily among stoners, jocks and geeks. Floyd is a star athlete, but he also likes smoking weed, which presents a conundrum when his football coach demands he sign a "no drugs" pledge.
0106697::::Demolition Man::::1993-10-08::::http://image.tmdb.org/t/p/w500//49GjSZn9FnSnrRFmsA4x5WAj8oB.jpg::::Simon Phoenix, a violent criminal cryogenically frozen in 1996, escapes during a parole hearing in 2032 in the utopia of San Angeles. Police are incapable of dealing with his violent ways and turn to his captor, who had also been cryogenically frozen after being wrongfully accused of killing 30 innocent people while apprehending Phoenix.
0106701::::Dennis the Menace::::1993-06-23::::http://image.tmdb.org/t/p/w500//t642WwGifbQ2fEuKTJRgpPzsgtX.jpg::::Mr. Wilson's ever-present annoyance comes in the form of one mischievous kid named Dennis. But he'll need Dennis's tricks to uncover a collection of gold coins that go missing when a shady drifter named Switchblade Sam comes to town.
0106761::::Double Dragon::::1994-11-04::::http://image.tmdb.org/t/p/w500//9ZTYSD8ZesYMKqLRbmVfZUW1FiE.jpg::::Two brothers have half of a powerful ancient Chinese talisman. An evil gang leader has the other half, and determines to get the brothers' half and have a complete medallion so he can gain absolute power.
