25::::The Oxford and Cambridge University Boat Race::::1895-03-30::::https://m.media-amazon.com/images/M/MV5BOGFiZjVkYmYtYjkwZC00NWY0LWI0MGItYWYyNzNlMDNlN2Y2XkEyXkFqcGdeQXVyNzg5OTk2OA@@._V1_.jpg::::Although the content of this film is primitive in the extreme - a shot of the traditional Oxford versus Cambridge University Boat Race, filmed on March 30 1895 - this film is of immense historical importance as being the first ever British film
0077269::::The Boys from Brazil::::1978-10-05::::http://image.tmdb.org/t/p/w500//dSgWAndpMGJVLYm1PquqBySgJvA.jpg::::Nazi hunter Ezra Lieberman discovers a sinister and bizarre plot to rekindle the Third Reich.
0077278::::Buck Rogers in the 25th Century::::1979-03-02::::http://image.tmdb.org/t/p/w500//vIpkKIAJiLHpiNQp3Dy0iranA8p.jpg::::Capt. William "Buck" Rogers is a jovial space cowboy who is accidentally time-warped from 1987 to 2491. Earth is engaged in interplanetary war following a global holocaust, and Buck's piloting skills make him an ideal starfighter recruit for the Earth Defense Directorate, where his closest colleagues are Dr. Huer (Tim O'Connor), squadron leader Col. Wilma Deering (former model Erin Gray), the wisecracking robot Twiki (voiced by cartoon legend Mel Blanc), and a portable computer-brain named Dr. Theopolis.
0077288::::La Cage aux Folles::::1978-10-25::::http://image.tmdb.org/t/p/w500//dC0UbDkYO9LKilNShzSKX8O2p3X.jpg::::Two gay men living in St. Tropez have their lives turned upside down when the son of one of the men announces he is getting married. They try conceal their lifestyle and their ownership of the transvestite club downstairs when the fiancée and her parents come for dinner.
0077289::::California Suite::::1978-12-15::::http://image.tmdb.org/t/p/w500//kgXKQXqikUDQRHjlaqOfcrqkY53.jpg::::The misadventures of four groups of guests at the Beverly Hills Hotel.
0077318::::The Chant of Jimmie Blacksmith::::1978-06-21::::http://image.tmdb.org/t/p/w500//rbyEtX16Tk58WMeii5rVEfB1OUm.jpg::::The true story of a part aboriginal man who finds the pressure of adapting to white culture intolerable, and as a result snaps in a violent and horrific manner.
077326::::The Children of Sanchez::::1979-04-12::::https://m.media-amazon.com/images/M/MV5BMGYxZDNhN2YtZDcyYi00NWJhLTlhOTQtMTQ4ZTg3YzZmMWQxXkEyXkFqcGdeQXVyMjMwOTA0Ng@@._V1_.jpg::::The Sanchez clan has seen the worst of times living in impoverished Mexico but they have survived by sticking together. When Sanchez's oldest daughter Consuelo plans to change direction and build a life of her own, the family and Sanchez face an enormous challenge.
0077402::::Dawn of the Dead::::2004-03-19::::http://image.tmdb.org/t/p/w500//cyIfbnRhzlBKNRUXZu17XT9uT9T.jpg::::A group of survivors take refuge in a shopping mall after the world is taken over by aggressive, flesh-eating zombies.
0077413::::Death on the Nile::::1978-10-06::::http://image.tmdb.org/t/p/w500//8eOWgeWrdM9cz7JR0LNp6R50j3l.jpg::::As Hercule Poirot enjoys a luxurious cruise down the Nile, a newlywed heiress is found murdered on board. Can Poirot identify the killer before the ship reaches the end of its journey?
0077523::::Every Which Way But Loose::::1978-12-19::::http://image.tmdb.org/t/p/w500//tcHqvDfTtxzUJVU3c8iGZtz4eyc.jpg::::Philo Beddoe is your regular, easygoing, truck-driving guy. He's also the best bar-room brawler west of the Rockies. And he lives with a 165-pound orangutan named Clyde. Like other guys, Philo finally falls in love - with a flighty singer who leads him on a screwball chase across the American Southwest. Nothing's in the way except a motorcycle gang, and legendary brawler Tank Murdock.
0077572::::Force 10 from Navarone::::1978-11-01::::http://image.tmdb.org/t/p/w500//3bFRwivCZuXx7fHWt4SpYaiHkNL.jpg::::Mallory and Miller are back. The survivors of Navarone are sent on a mission along with a unit called Force 10, which is led by Colonel Barnsby. But Force 10 has a mission of their own which the boys know nothing about.
0077663::::Heaven Can Wait::::1943-08-05::::http://image.tmdb.org/t/p/w500//tgehyNNVOD0sef6zJbQJKHxDNKH.jpg::::Spoiled playboy Henry van Cleve dies and arrives at the entrance to Hell, a final destination he is sure he deserves after living a life of profligacy. The devil, however, isn't so sure Henry meets Hell's standards. Convinced he is where he belongs, Henry recounts his life's deeds, both good and bad, including an act of indiscretion during his 25-year marriage to his wife, Martha, with the hope that "His Excellency" will arrive at the proper judgment.
0077681::::The Hills Have Eyes::::2006-03-10::::http://image.tmdb.org/t/p/w500//qj4C2c96T1n3YnYxFG5l5bSTKbM.jpg::::Based on Wes Craven's 1977 suspenseful cult classic, The Hills Have Eyes is the story of a family road trip that goes terrifyingly awry when the travelers become stranded in a government atomic zone. Miles from nowhere, the Carter family soon realizes the seemingly uninhabited wasteland is actually the breeding ground of a blood-thirsty mutant family...and they are the prey.
0077714::::I Wanna Hold Your Hand::::1978-04-01::::http://image.tmdb.org/t/p/w500//wEQIPOaOzdiZG5lOBbSRKnVWMOc.jpg::::If they missed Beatles' first appearance in the U.S.A. they would hate themselves for the rest of their lives! So six young girls from New Jersey set off even though they don't have tickets for the show! The journey is full of surprises and misfortunes but the young ladies are determined to reach their idols.
0077743::::International Velvet::::1978-07-19::::http://image.tmdb.org/t/p/w500//uaMQov2qlsrjJERrYywisfjtds7.jpg::::A charming sequel to the hit National Velvet follows our young heroine and her trusty steed overseas.
0077745::::Invasion of the Body Snatchers::::1956-02-05::::http://image.tmdb.org/t/p/w500//8BrMQmgwGzIHSyBjCDOLOdi79fJ.jpg::::A small-town doctor learns that the population of his community is being replaced by emotionless alien duplicates.
0077775::::The Elephant God::::1979-01-04::::http://image.tmdb.org/t/p/w500//v0CPONn71dFF6Kl2bossZnRJQea.jpg::::Set in the holy city of Benares, this is the second film about the detective Feluda, in which he goes for a holiday along with his cousin, Topshe and his friend, Lalmohan Ganguly. But the theft of a priceless deity of Lord Ganesh (the Elephant God) from a local household forces him to investigate.
0077869::::The Lord of the Rings: The Two Towers::::2002-12-18::::http://image.tmdb.org/t/p/w500//5VTN0pR8gcqV3EPUHHfMGnJYN9L.jpg::::Frodo and Sam are trekking to Mordor to destroy the One Ring of Power while Gimli, Legolas and Aragorn search for the orc-captured Merry and Pippin. All along, nefarious wizard Saruman awaits the Fellowship members at the Orthanc Tower in Isengard.
0077921::::The Medusa Touch::::1978-04-13::::http://image.tmdb.org/t/p/w500//sk523UMvmmiFMsGKxerGiwSQWdZ.jpg::::A French detective in London reconstructs the life of a man lying in hospital with severe injuries with the help of journals and a psychiatrist. He realises that the man had powerful telekinetic abilities.
0077928::::Midnight Express::::1978-08-31::::http://image.tmdb.org/t/p/w500//vtXJf6DP2rk1yDx369MSAvwl9Cs.jpg::::Billy Hayes is caught attempting to smuggle drugs out of Turkey. The Turkish courts decide to make an example of him, sentencing him to more than 30 years in prison. Hayes has two opportunities for release: the appeals made by his lawyer, his family, and the American government, or the "Midnight Express".
0078106::::Powers of Ten::::1977-01-01::::http://image.tmdb.org/t/p/w500//vPfnkN2ZFeWCg19INDLCBbfYP0r.jpg::::A scientific film essay, narrated by Phil Morrison. A set of pictures of two picnickers in a park, with the area of each frame one-tenth the size of the one before. Starting from a view of the entire known universe, the camera gradually zooms in until we are viewing the subatomic particles on a man's hand.
0078199::::Same Time, Next Year::::1978-04-23::::http://image.tmdb.org/t/p/w500//75oDfYsQ1R9OailpMGLn6BZD5Nr.jpg::::A man and woman meet by chance at a romantic inn over dinner. Although both are married to others, they find themselves in the same bed the next morning questioning how this could have happened. They agree to meet on the same weekend each year. Originally a stage play, the two are seen changing, years apart, always in the same room in different scenes. Each of them always appears on schedule, but as time goes on each has some personal crisis that the other helps them through, often without both of them understanding what is going on.
0078239::::Sgt. Pepper's Lonely Hearts Club Band::::1978-07-24::::http://image.tmdb.org/t/p/w500//fxpPgpCbzKluSizyN21SHXiVZ15.jpg::::A small town band makes it big, but loses track of their roots, as they get caught up into the big-time machinations of the music biz. Now, they must thwart a plot to destroy their home town. Built around the music of the beatles, this musical uses some big name groups like Peter Frampton and Aerosmith.
0078382::::Thank God It's Friday::::1978-05-19::::http://image.tmdb.org/t/p/w500//uvGc3eVlVmUIEDLqEfX0feYoSPK.jpg::::It's Friday and everyone is going to the hot new disco. The Commodores are scheduled to play if Floyd shows up with the instruments and Nicole dreams of becoming a disco star. Other characters are there to win the dance contest, or to put a little excitement into a fifth anniversary.
0078389::::The Thirty Nine Steps::::1978-11-04::::http://image.tmdb.org/t/p/w500//3O0uufW4HU8Ro5GPg84pcKpRHii.jpg::::The year is 1914 and Richard Hannay, Mining Engineer who is visiting Britain for a short time before returning to South Africa, is shocked when one of his neighbours, Colonel Scudder, bursts into his rooms one night and tells him a story that Prussian 'sleeper' agents are planning to pre-start World War I by murdering a visiting foreign minister. However, Scudder is murdered and Hannay is framed for the death by the 'sleepers'. Fleeing to Scotland Hannay attempts to clear his name and to stop the agents with the aid of Alex Mackenzie but not only is he is chased by Chief Supt Lomas for Scudder's death but by the agents who are headed by Appleton who has managed to hide himself in a high-placed position in the British Government...
0078417::::Le mystère du triangle des Bermudes::::1978-04-14::::https://m.media-amazon.com/images/M/MV5BOGY1MTg4ZTEtOWQwYS00YWEzLWJjODAtYWFiZGMwNzIzMDJhXkEyXkFqcGdeQXVyMTQ2MjQyNDc@._V1_.jpg::::The passengers and crew of a boat on a summer cruise in the Caribbean stray near the famed Bermuda Triangle, and mysterious things start happening.
0078480::::Watership Down::::1978-10-14::::http://image.tmdb.org/t/p/w500//jUe0psjAr8w4cX4XRg5EOYoRY7t.jpg::::When the warren belonging to a community of rabbits is threatened, a brave group led by Fiver, Bigwig, Blackberry and Hazel leave their homeland in a search of a safe new haven.
0078718::::...And Justice for All::::1979-10-19::::http://image.tmdb.org/t/p/w500//AiAXiqN883MYQMzxeEzAtV9jkU0.jpg::::An ethical Baltimore defense lawyer disgusted with rampant legal corruption is asked to defend a judge he despises in a rape trial. But if he doesn't do it, the judge will have him disbarred.
0078754::::All That Jazz::::1979-12-20::::http://image.tmdb.org/t/p/w500//meLHG7ZMan8WKVmF5tCTy4B0Hjg.jpg::::Joe Gideon is at the top of the heap, one of the most successful directors and choreographers in musical theater. But he can feel his world slowly collapsing around him - his obsession with work has almost destroyed his personal life, and only his bottles of pills keep him going.
0078767::::The Amityville Horror::::2005-04-14::::http://image.tmdb.org/t/p/w500//1ZM4aU6jJ8wx1tX3ElnZZdKjX8n.jpg::::This hair-raising remake of the 1979 horror hit depicts the ordeal of the Lutz clan, whose new home has a gory past and a legacy of demons. Before long, the family patriarch is plagued by nightmares and his daughter is seeing phantoms.
0078790::::The Apple Dumpling Gang Rides Again::::1979-06-27::::http://image.tmdb.org/t/p/w500//wqvmT1BfNwaz9ivCZnzXLdRPvf2.jpg::::Amos and Theodore, the two bumbling outlaw wannabes from The Apple Dumpling Gang, are back and trying to make it on their own. This time, the crazy duo gets involved in an army supply theft case -- and, of course, gets in lots of comic trouble along the way!
0078856::::Beyond the Poseidon Adventure::::1979-05-18::::http://image.tmdb.org/t/p/w500//zaLLaf4Ugl3koI9f2QZmHfQnRow.jpg::::After "The Poseidon Adventure", in which the ship got flipped over by a tidal wave, the ship drifts bottom-up in the sea. While the passengers are still on board waiting to be rescued, two rivaling salvage parties enter the ship on search for money, gold and a small amount of plutonium.
0078872::::The Black Stallion::::1979-10-13::::http://image.tmdb.org/t/p/w500//uZtNc31LR5Ik3ZVo2jxwOvhkNRC.jpg::::While traveling with his father, young Alec becomes fascinated by a mysterious Arabian stallion that is brought on board and stabled in the ship he is sailing on. When it tragically sinks both he and the horse survive only to be stranded on a deserted island. He befriends it, so when finally rescued both return to his home where they soon meet Henry Dailey, a once successful trainer. Together they begin training the horse to race against the fastest ones in the world.
0079116::::Escape from Alcatraz::::1979-01-25::::http://image.tmdb.org/t/p/w500//fEXxILY3zm8821sEMSHrD1rjMe.jpg::::Escape from Alcatraz tells the story of the only three men ever to escape from the infamous maximum security prison at Alcatraz. In 29 years, the seemingly impenetrable federal penitentiary, which housed Al Capone and "Birdman" Robert Stroud, was only broken once - by three men never heard of again.
0079240::::The First Great Train Robbery::::1978-12-14::::http://image.tmdb.org/t/p/w500//6dfiOhkLiy2NVvDS5yfHjEk85y2.jpg::::In Victorian England, a master criminal makes elaborate plans to steal a shipment of gold from a moving train.
0079353::::It Shouldn't Happen to a Vet::::1976-04-08::::https://m.media-amazon.com/images/M/MV5BNGNjMTFlNjUtNDIxMS00NDZiLWE5ZDItYmE0NGNkYmQwZGRkXkEyXkFqcGdeQXVyNzM0MDQ1Mw@@._V1_.jpg::::Comedy-drama based on the books by James Herriot about a Yorkshire vet and the adventures he and his colleague have in their everyday life.
0079428::::The Lady Vanishes::::1938-10-07::::http://image.tmdb.org/t/p/w500//e9yjeqzcsFEhwTsv2Lv9RTZhHaJ.jpg::::On a train headed for England a group of travelers is delayed by an avalanche. Holed up in a hotel in a fictional European country, young Iris befriends elderly Miss Froy. When the train resumes, Iris suffers a bout of unconsciousness and wakes to find the old woman has disappeared. The other passengers ominously deny Miss Froy ever existed, so Iris begins to investigate with another traveler and, as the pair sleuth, romantic sparks fly.
0079596::::My Brilliant Career::::1979-08-17::::http://image.tmdb.org/t/p/w500//s89ZolmE0tD5stOJhy6Jh4V3txZ.jpg::::A young woman who is determined to maintain her independence finds herself at odds with her family who wants her to tame her wild side and get married.
0079668::::The Onion Field::::1979-09-09::::http://image.tmdb.org/t/p/w500//q0tSicTWcfVJZZWDki1YByNHydP.jpg::::Greg Powell, a disturbed ex-con, recruits Jimmy Youngblood (Smith) a petty thief, as partner in crime. Powell panics when they two of are pulled over by two cops for tail lights. Powell decides to kidnap the cops and Smith goes along with his crazy scheme. They drive out to a deserted onion field in Bakersfield, where one cop is killed and the other escapes. The film explores the consequences.
0079672::::Opening Night::::1977-12-22::::http://image.tmdb.org/t/p/w500//f5PAFIuTLP7hRQkTzYAO0INXHB5.jpg::::Actress Myrtle Gordon is a functioning alcoholic actress who is a few days from the opening night of her latest play, concerning a woman distraught about aging. One night a car kills one of Myrtle's fans who is chasing her limousine in an attempt to get the star's attention. Myrtle internalizes the accident and goes on a spiritual quest, but fails to finds the answers she is after. As opening night inches closer and closer, fragile Myrtle must find a way to make the show go on.
0079688::::Over the Edge::::1979-11-02::::http://image.tmdb.org/t/p/w500//qSOYYtslBhH1kXIqA3h8FgecQe7.jpg::::The music of Cheap Trick, The Cars, and The Ramones highlights this realistic tale of alienated suburban youth on the rampage. Dillon makes his screen debut in this updated, well-done "Rebel Without a Cause." Shelved for several years, the movie was finally released after Dillon made it big. Sleeper with excellent direction and dialogue.
0079807::::Richard Pryor: Live in Concert::::1979-01-26::::http://image.tmdb.org/t/p/w500//zguG43yzPkiiNOyR9P1HglVNYOl.jpg::::Richard Pryor delivers monologues on race, sex, family and his favorite target—himself, live at the Terrace Theatre in Long Beach, California.
0079808::::The Riddle of the Sands::::1979-10-02::::http://image.tmdb.org/t/p/w500//qF55CFOjmFyNpA7VsjRwuWbiPcd.jpg::::In the early years of the 20th Century, two British yachtsmen (Michael York and Simon MacCorkindale) stumble upon a German plot to invade the east coast of England in a flotilla of specially designed barges. They set out to thwart this terrible scheme, but must outwit not only the cream of the German Navy, but the feared Kaiser Wilhelm himself.
0079945::::Star Trek: The Motion Picture::::1979-12-07::::http://image.tmdb.org/t/p/w500//wfiAfNwH6CMKxz4vRaW8CPTabtk.jpg::::When a destructive space entity is spotted approaching Earth, Admiral Kirk resumes command of the Starship Enterprise in order to intercept, examine, and hopefully stop it.
0080025::::Time After Time::::1979-08-31::::http://image.tmdb.org/t/p/w500//A4SXZxQempzTUReRlQiFaYc6KaC.jpg::::The Wildest Chase Of The Century! London 1893 is home to a killer with a macabre nickname... and also to a visionary genius who would write The Time Machine. But what if H.G. Wells' invention wasn't fiction? And what if Jack the Ripper escaped capture fleeing his own time to take refuge in ours - with Wells himself in pursuit?
0080117::::The Wanderers::::1979-07-13::::http://image.tmdb.org/t/p/w500//oedFtX9hZZWpD7L5wkD0WxSteY2.jpg::::The streets of the Bronx are owned by '60s youth gangs where the joy and pain of adolescence is lived. Philip Kaufman tells his take on the novel by Richard Price about the history of the Italian-American gang ‘The Wanderers.’
0080130::::When a Stranger Calls::::2006-02-03::::http://image.tmdb.org/t/p/w500//h0ZmU7BZDWBucq1FvblfeAWUkad.jpg::::Far away from the site of a gruesome murder, a teenager named Jill Johnson arrives at a luxurious home for a baby-sitting job. With the children fast asleep, she settles in for what she expects to be an ordinary evening. Soon, the ringing of a phone and the frightening words of a sadistic caller turn Jill's routine experience into a night of terror.
0080388::::Atlantic City::::1980-09-02::::http://image.tmdb.org/t/p/w500//7FabfUSZJqBc4ikZetcR866Y2C3.jpg::::In a corrupt city, a small-time gangster and the estranged wife of a pot dealer find themselves thrown together in an escapade of love, money, drugs and danger.
0080402::::The Awakening::::2011-08-17::::http://image.tmdb.org/t/p/w500//8PBNg3notVJLObDGQohLBOfwGfE.jpg::::1921 England is overwhelmed by the loss and grief of World War I. Hoax exposer Florence Cathcart (Hall) visits a boarding school to explain sightings of a child ghost.
0080453::::The Blue Lagoon::::1980-07-05::::http://image.tmdb.org/t/p/w500//hg57Zr63A96mpIQKHxOjHYqCVhI.jpg::::Two small children and a ship's cook survive a shipwreck and find safety on an idyllic tropical island. Soon, however, the cook dies and the young boy and girl are left on their own. Days become years and Emmeline and Richard make a home for themselves surrounded by exotic creatures and nature's beauty. But will they ever see civilization again?
0080455::::The Blues Brothers::::1980-06-17::::http://image.tmdb.org/t/p/w500//3DiSrcYELCLkwnjl9EZp2pkKGep.jpg::::Jake Blues is just out of jail, and teams up with his brother, Elwood on a 'mission from God' to raise funds for the orphanage in which they grew up. The only thing they can do is do what they do best: play music. So they get their old band together, and set out on their way—while getting in a bit of trouble here and there.
0080516::::The Changeling::::1980-03-28::::http://image.tmdb.org/t/p/w500//z4nTYj3JZ5jWAhDgrmEhW2GRAzb.jpg::::After a tragic event happens, composer John Russell moves to Seattle to try to overcome it and build a new and peaceful life in a lonely big house that has been uninhabited for many years. But, soon after, the obscure history of such an old mansion and his own past begin to haunt him.
0080549::::Coal Miner's Daughter::::1980-03-07::::http://image.tmdb.org/t/p/w500//sNOMyIYP2wz1sFKSJmlKPjYz6ok.jpg::::Biography of Loretta Lynn, a country and western singer that came from poverty to fame.
0080641::::The Dogs of War::::1980-12-17::::http://image.tmdb.org/t/p/w500//qTcs8v9VNOOF8FSaWPpFGRYeUa8.jpg::::Mercenary James Shannon, on a reconnaissance job to the African nation of Zangaro, is tortured and deported. He returns to lead a coup.
0080661::::Dressed to Kill::::1980-07-25::::http://image.tmdb.org/t/p/w500//zDGtihDRIF54sJB4bNewwKcpmxv.jpg::::A mysterious, tall, blonde woman wearing sunglasses murders one of a psychiatrist's patients, and now she's after the prostitute who witnessed it.
0080678::::The Elephant Man::::1980-10-02::::http://image.tmdb.org/t/p/w500//19Hc54ebzdvF3usVEmyn948U4Xr.jpg::::A Victorian surgeon rescues a heavily disfigured man being mistreated by his "owner" as a side-show freak. Behind his monstrous façade, there is revealed a person of great intelligence and sensitivity. Based on the true story of Joseph Merrick (called John Merrick in the film), a severely deformed man in 19th century London.
0080736::::The Final Countdown::::1980-01-31::::http://image.tmdb.org/t/p/w500//4Xiq9xnaNn1tER7ltyZ3bQF6fRZ.jpg::::During routine manoeuvres near Hawaii in 1980, the aircraft-carrier USS Nimitz is caught in a strange vortex-like storm, throwing the ship back in time to 1941—mere hours before the Japanese attack on Pearl Harbor.
0080761::::Friday the 13th::::2009-02-11::::http://image.tmdb.org/t/p/w500//88wlJ4teYlck4hJ2bnlxBrAVh0m.jpg::::Ignoring the warnings of the locals, a group of teenage camp counselors takes on the job of reopening Camp Crystal Lake — on Friday the 13th no less, and raise the ire of Jason Voorhees, a masked, homicidal maniac.
0080776::::Garlic Is as Good as Ten Mothers::::1980-10-12::::http://image.tmdb.org/t/p/w500//rrUnwXafmZzPdSqmVzx1gQACCRf.jpg::::A zesty paean of praise to the greater glories of garlic. This lip-smacking foray into the history, consumption, cultivation and culinary/curative powers of the stinking rose features chef Alice Waters of Chez Panisse, and a flavorful musical soundtrack.
0080839::::The Happy Hooker Goes Hollywood::::1980-06-04::::http://image.tmdb.org/t/p/w500//wG82foVK0eX49AS5ObrLeSbYzme.jpg::::Xaviera Hollander has to navigate some sleazy studio politics to see the production of the film version of her memoirs.
0080855::::Heaven's Gate::::1980-11-19::::http://image.tmdb.org/t/p/w500//uP1YzFfxnCYWAebJtxmX6CPiD3a.jpg::::Harvard graduate James Averill is the sheriff of prosperous Jackson County, Wyo., when a battle erupts between the area's poverty-stricken immigrants and its wealthy cattle farmers. The politically connected ranch owners fight the immigrants with the help of Nathan Champion, a mercenary competing with Averill for the love of local madam Ella Watson. As the struggle escalates, Averill and Champion begin to question their decisions.
0080895::::How to Beat the High Co$t of Living::::1980-07-11::::http://image.tmdb.org/t/p/w500//f6xfZu2CwUV7I03THE4AHye0saD.jpg::::Oregon, 1980: Jane, Elaine and Louise are all feeling the effects of inflation and cannot afford, as the title states, the high cost of living. Jane cannot afford a babysitter or get married and if she wants privacy with her boyfriend, she has to sleep in the car. Even worse, her war veteran father comes to live with her to turn her life upside down. Louise lives a happy life with her veterinarian husband, Albert. She runs an antique shop on the side, but since it doesn't take in any profit, the IRS considers it a hobby. She needs to come up with the money to keep it going, or she will be trouble with the IRS. Elaine's husband has left her for another woman and without any money. She is in a constant struggle with banks, power companies, and gas stations. She needs money to get by and also catches the eye of police officer Jack. The local mall is having a contest that features a giant money ball that states it will help fight the inflation...
0080904::::Humanoids from the Deep::::1980-05-01::::http://image.tmdb.org/t/p/w500//jVqNWDvTIwjcHsMyNSUT0sfGrq9.jpg::::They're not human. But they hunt human women. Not for killing. For mating.
0080948::::The Jazz Singer::::1927-10-06::::http://image.tmdb.org/t/p/w500//hO3pM0Pf8eGnkt8049aKYr8yqJF.jpg::::A young Jewish man is torn between tradition and individuality when his old-fashioned family objects to his career as a jazz singer. This is the first full length feature film to use synchronized sound, and is the original film musical.
0081159::::Midnight Madness::::1980-02-08::::http://image.tmdb.org/t/p/w500//6p3ECqPStpubtuSTI16ZMfQv5bv.jpg::::A genius grad student organizes an all-night treasure hunt in which five rival teams composed of colorful oddballs furiously match wits with one another while trying to locate and decipher various cryptic clues planted ingeniously around Los Angeles.
