25::::The Oxford and Cambridge University Boat Race::::1895-03-30::::https://m.media-amazon.com/images/M/MV5BOGFiZjVkYmYtYjkwZC00NWY0LWI0MGItYWYyNzNlMDNlN2Y2XkEyXkFqcGdeQXVyNzg5OTk2OA@@._V1_.jpg::::Although the content of this film is primitive in the extreme - a shot of the traditional Oxford versus Cambridge University Boat Race, filmed on March 30 1895 - this film is of immense historical importance as being the first ever British film
0051201::::Witness for the Prosecution::::1957-12-17::::http://image.tmdb.org/t/p/w500//bCj4EfuehAlgBwVd3diyWyhuuau.jpg::::When Leonard Vole is arrested for the sensational murder of a rich, middle-aged widow, the famous Sir Wilfrid Robarts agrees to appear on his behalf. Sir Wilfrid, recovering from a near-fatal heart attack, is supposed to be on a diet of bland, civil suits—but the lure of the criminal courts is too much for him, especially when the case is so difficult.
0051346::::Alive and Kicking::::2017-04-07::::http://image.tmdb.org/t/p/w500//6xai2jrRiRZWhFCyxu905HUkd2S.jpg::::Alive and Kicking gives the audience an intimate, insider’s view into the culture of the current swing dance world while shedding light on issues facing modern American society.
0051429::::Bonjour Tristesse::::1958-01-15::::http://image.tmdb.org/t/p/w500//2KFoUQ1JXrazABCVglJPGF6isIL.jpg::::Cecile is a decadent young girl who lives with her rich playboy father, Raymond. When Anne, Raymond's old love interest, comes to Raymond's villa, Cecile is afraid for her way of life.
0051459::::Cat on a Hot Tin Roof::::1958-09-20::::http://image.tmdb.org/t/p/w500//vWf1AR8rC6WjGKELlmLv2VAUZJB.jpg::::An alcoholic ex-football player drinks his days away, having failed to come to terms with his sexuality and his real feelings for his football buddy who died after an ambiguous accident. His wife is crucified by her desperation to make him desire her: but he resists the affections of his wife. His reunion with his father—who is dying of cancer—jogs a host of memories and revelations for both father and son.
0051534::::Desire Under the Elms::::1958-03-12::::http://image.tmdb.org/t/p/w500//lvRCRiVQtDv5OtlnhB1L8sw08jj.jpg::::Ephraim Cabot is an old man of amazing vitality who loves his New England farm with a greedy passion. Hating him, and sharing his greed, are the sons of two wives Cabot has overworked into early graves. Most bitter is Eben, whose mother had owned most of the farm, and who feels who should be sole heir. When the old man brings home a new wife, Anna, she becomes a fierce contender to inherit the farm. Two of the sons leave when Eben gives them the fare in return for their shares of the farm. Meanwhile, Anna tries to cause some sparks by rubbing up against Eben.
0051634::::Free Radicals::::1958-04-23::::http://image.tmdb.org/t/p/w500//9VApH2rC5ZA6jVyX38HlS5HvF4R.jpg::::In this powerful abstract film with a soundtrack of African drum music, Lye scratched "white ziggle-zag-splutter scratches" on to black leader, using a variety of tools from saw teeth to arrow heads. The first version of the film won a major award at the International Experimental Film Festival Held in Brussels in 1958 in association with the World's Fair. Stan Brakhage described the film as "an almost unbelievably immense masterpiece".
0051739::::The Horse's Mouth::::1958-11-11::::http://image.tmdb.org/t/p/w500//d51I6HuDzwEk5CWZE4E4Uegz3WF.jpg::::Gulley Jimson is a boorish aging artist recently released from prison. A swindler in search of his next art project, he hunkers down in the penthouse of would-be patrons the Beeders while they go on an extended vacation; he paints a mural on their wall, pawns their valuables and, along with the sculptor Abel, inadvertently smashes a large hole in their floor. Jimson's next project is an even larger wall in an abandoned church.
0051744::::House on Haunted Hill::::1999-10-29::::http://image.tmdb.org/t/p/w500//weiGTsZqBglKxkIn5xj1nEjxn81.jpg::::A remake of the 1959 film of the same name. A millionaire offers a group of diverse people $1,000,000 to spend the night in a haunted house with a horrifying past.
0051747::::Howrah Bridge::::2018-02-02::::http://image.tmdb.org/t/p/w500//m17OZKOlXoZY2fmUfChOKeGFuN5.jpg::::Arjun is a software engineer working in Kolkata. He loves Sweety right from his childhood and he finds it so difficult to forget her. He comes to Machavaram village for her and befriend her as childhood friend. They both get along well and after series of incidents she also falls for him and she cancels her marriage with her brother in law. This is the time where Arjun leaves the village and sends Sweety a video message and says he don’t want marriage with her. What is the reason for him to do so? What happens after that?
0051759::::I Was Monty's Double::::1958-10-21::::http://image.tmdb.org/t/p/w500//a8KyM9Lowhda5JtiJQ3kFRWEVFS.jpg::::The incredible but true story of how an impersonator was recruited to impersonate General Montgomery to mislead the German's about his intentions before the North Africa campaign.
0051776::::The Inn of the Sixth Happiness::::1958-12-11::::http://image.tmdb.org/t/p/w500//qSkuoH1e3pUO2sbwESHqq2CNPel.jpg::::All her life Englishwoman Gladys Aylward knew that China was the place where she belonged. Not qualified to be sent there as a missionary, Gladys works as a domestic to earn the money to send herself to a poor, remote village. There she eventually lives a full and happy life: running the inn, acting as "foot inspector", advising the local Mandarin and even winning the heart of mixed race Captain Lin Nan. But Gladys discovers her real destiny when the country is invaded by Japan and the Chinese children need her to save their lives. Based on a true story.
0051845::::The Last Hurrah::::1958-10-24::::http://image.tmdb.org/t/p/w500//e6HTm3fa65OUqmLtaVGaaJKRIK0.jpg::::An aging politician tries to get re-elected one last time in the changing world of the 1950s when TV started to play a bigger part in politics. Based loosely on the career of multi-term Boston Mayor James Michael Curley, this film examines the good and evil inherent in politics and all the things that go into an election. Tracy's uphill battle to stay in office is set against the political machinery that preyed on ethnic hatred and old-time money.
0051847::::Law and Disorder::::1974-10-09::::http://image.tmdb.org/t/p/w500//xR1w8709Uv7KMNCDENH1luS7B0e.jpg::::In crime ridden New York of the seventies two cops has had enough. They decide to take justice into their own hands. Things turn exciting and humorous. No hoodlum goes safe.
0051896::::The Man Who Wouldn't Talk::::1958-01-21::::http://image.tmdb.org/t/p/w500//sr2pjnf7hzFhUMVq0twxTDEHl9s.jpg::::American scientist Dr. Frank Smith is brought to Britain to help the C.I.A. There is a defecting East block scientist they want him to debrief. The commies are less than amused and set Dr. Smith up for a murder.  Zsa Zsa Gabor plays one of the CIA agents.
0051994::::A Night to Remember::::1958-07-03::::http://image.tmdb.org/t/p/w500//6fDhJAz6AuYWj3hAnvUL42Xlxfj.jpg::::The sinking of the Titanic is presented in a highly realistic fashion in this tense British drama. The disaster is portrayed largely from the perspective of the ocean liner's second officer, Charles Lightoller. Despite numerous warnings about ice, the ship sails on, with Capt. Edward John Smith keeping it going at a steady clip. When the doomed vessel finally hits an iceberg, the crew and passengers discover that they lack enough lifeboats, and tragedy follows.
0052005::::No Time for Sergeants::::1958-07-05::::http://image.tmdb.org/t/p/w500//yCoIRzy6C5TCXN0ibD2IqEqqOgl.jpg::::Georgia farm boy Will Stockdale is about to bust with pride. He’s been drafted. Will’s ready. But is Uncle Sam ready for Will? In No Time for Sergeants, Andy Griffith is certifiably funny in the role that clinched his stardom. Wearing a friendly, wide grin, he ambles into the U.S. Air Force – and lots of folks’ll never be the same.
0052027::::The Old Man and the Sea::::1991-06-23::::http://image.tmdb.org/t/p/w500//tlX71ziFH52SecHM3pdVcFj3Tbr.jpg::::Based on the novel by Ernest Hemingway. Santiago goes out on his usual fishing trip and makes a huge catch, the biggest of his life. Then a shark attacks and tries to steal his catch.
0052106::::The Quiet American::::2002-11-22::::http://image.tmdb.org/t/p/w500//xk5XdHkD3AnS20TUgkkpHpraS6T.jpg::::A stylish political thriller where love and war collide in Southeast Asia. Set in early 1950s Vietnam, a young American becomes entangled in a dangerous love triangle when he falls for the beautiful mistress of a British journalist. As war is waged around them, these three only sink deeper into a world of drugs, passion, and betrayal where nothing is as it seems.
0052126::::The Reluctant Debutante::::1958-01-01::::http://image.tmdb.org/t/p/w500//qQxiJewNe8AT0Tx3d6KXQJzIQ5M.jpg::::Jimmy and Sheila Broadbent, welcome to London Jimmy's 17-year-old daughter, Jane. Jane is from Jimmy's first marriage to an American and has come to visit her father and the step-mother she has never met. While visiting Sheila has the idea of making Jane a debutante, an idea Jane resists. Difficulties range from Jane's apathy to being placed on the marriage block, the determined efforts of Sheila's cousin, Mabel Claremont, to win wealthy David Fenner for her debutante daughter Clarissa, and Jane's attraction to David Parkson, an American drummer who plays in the orchestra at the coming-out balls.
0052141::::Rock-a-Bye Baby::::1958-07-23::::http://image.tmdb.org/t/p/w500//bLemftNatDRpPxCINGxUR4QNRw9.jpg::::An average television repairman must care for the newborn triplets of his former hometown sweetheart—now a famous movie star—so her career will not suffer.
0052151::::Run Silent, Run Deep::::1958-03-27::::http://image.tmdb.org/t/p/w500//gIoao6u9DiTSyXWk4PFD0MX6PXx.jpg::::The captain of a submarine sunk by the Japanese during WWII is finally given a chance to skipper another sub after a year of working a desk job. His singleminded determination for revenge against the destroyer that sunk his previous vessel puts his new crew in unneccessary danger.
0052182::::Separate Tables::::1958-12-18::::http://image.tmdb.org/t/p/w500//b3hlE6eA3ztGIDatBE5hrAubPg5.jpg::::Boarders at an English resort struggle with emotional problems.
0052191::::The Sheriff of Fractured Jaw::::1958-10-28::::http://image.tmdb.org/t/p/w500//4wxXAz32nEWjjg4jGYsugUy7MGV.jpg::::The story centres around Jonathon Tibbs, the young son of a family of English gunsmiths. He travels to the American West in the 1880s to sell firearms to the locals. While there he inadvertently acquires a reputation of quickness on the draw due to his wrist mounted Derringer style weapon and from there the post of sheriff. He endeavours to clean up the town using what skills he has and by multilateral diplomacy.
0052218::::Some Came Running::::1958-12-18::::http://image.tmdb.org/t/p/w500//oFivW0sMerjzWmC6GI8axAfc5xy.jpg::::Dave Hirsch, a writer and army veteran, returns to 1948 Parkman, Indiana, his hometown. His prosperous brother introduces him to Gwen French...
0052225::::South Pacific::::1958-03-18::::http://image.tmdb.org/t/p/w500//nYNltu2clFoRQGBz9BtZUTcCbUm.jpg::::Can a girl from Little Rock find happiness with a mature French planter she got to know one enchanted evening away from the military hospital where she is a nurse? Or should she just wash that man out of her hair? Bloody Mary is the philosopher of the island and it's hard to believe she could be the mother of Liat who has captured the heart of Lt. Joseph Cable USMC. While waiting for action in the war in the South Pacific, sailors and nurses put on a musical comedy show. The war gets closer and the saga of Nellie Forbush and Emile de Becque becomes serious drama.
0052270::::A Tale of Two Cities::::1958-02-07::::http://image.tmdb.org/t/p/w500//t4Ni1CxJhREfhAbsZVYRnE2mvnR.jpg::::British barrister Sydney Carton lives an insubstantial and unhappy life. He falls under the spell of Lucie Manette, but Lucie marries Charles Darnay. When Darnay goes to Paris to rescue an imprisoned family retainer, he becomes entangled in the snares of the brutal French Revolution and is himself jailed and condemned to the guillotine. But Sydney Carton, in love with a woman he cannot have, comes up with a daring plan to save her husband.
0052278::::Teacher's Pet::::2004-01-16::::http://image.tmdb.org/t/p/w500//3IiwOT4QF4beOOdCLbJxdw7xzH1.jpg::::Disney creates a whole new breed of comedy with a character unlike any other. Meet Spot, a clever little dog with big dreams of becoming a real boy. When Spot finds out that a crazy scientist can make his wish come true, he takes a cross-country trek with his best friend and master Leonard and their mom. However, Dr. Krank's experiments are a little less than perfect, and it will take Leonard and his pet pals to right this genetic wrong.
0052322::::The True Story of Lynn Stuart::::1958-09-24::::https://m.media-amazon.com/images/M/MV5BMTU5ZDQ0N2EtZDZkMy00YmY4LWIzODgtMGI2NjcwY2IwMjBhXkEyXkFqcGdeQXVyNTUyNzA5ODE@._V1_SY1000_CR0,0,666,1000_AL_.jpg::::When the nephew and his friend of Phyllis Carter are killed in an automobile crash while under the influence of narcotics, she persuades Police Lieutenant Jim Hahan to use her as an undercover agent, despite the fact she is married and has a young son. She is trained to impersonate "Lynn Stuart", who did time for a bank hold-up, and is given a job at a drive-in restaurant where members of a narcotics gang are known to frequent. She attracts the attention of Willie Down, a mid-level boss in the gang and begins getting information from him which she passes on to the FBI. Her husband, alarmed over the health of their son gets her to promise to quit. Willie takes her to Mexico before she can inform anyone where she is going, where he and a gang henchman murder the driver and guard of a truck transporting dope and hijack the load. Phyllis/Lynn goes to the ladies room of a service station where she scribbles their destination on a mirror using lipstick hoping to be rescued.
0052415::::The Young Lions::::1958-04-02::::http://image.tmdb.org/t/p/w500//qqID4i9EZ0zAw1uDKsi6lOyLsst.jpg::::The Young Lions follows the lives of three soldiers: one German and two Americans, paralleling their experiences in World War II until they meet up at the end for a confrontation
0052619::::The Best of Everything::::1959-10-09::::http://image.tmdb.org/t/p/w500//ul1huXiYcVPv3OmCxcwYx4slccv.jpg::::An exposé of the lives and loves of Madison Avenue working girls and their higher-ups.
0052631::::The Black Orchid::::1958-09-03::::http://image.tmdb.org/t/p/w500//4vJxCBgKaA88jNb1S1g342JJq1p.jpg::::An aging widower fights family disapproval when he falls in love with a gangster's widow.
0052695::::Mrs. Parker and the Vicious Circle::::1994-09-07::::http://image.tmdb.org/t/p/w500//avTHiIim0Jm0rs4ehFLck8u3NFW.jpg::::Dorothy Parker remembers the heyday of the Algonquin Round Table, a circle of friends whose barbed wit, like hers, was fueled by alcohol and flirted with despair.
0052722::::Darby O'Gill and the Little People::::1959-06-29::::http://image.tmdb.org/t/p/w500//82z3Q1fKbPMLETCHHb81JPKZwPl.jpg::::Take a wee bit of ancient folklore, mix in some spectacular special effects and a magical cast (including Sean Connery) -- and you've got one of the most enchanting fantasies of all time! A frisky old storyteller named Darby O'Gill is desperately seeking the proverbial pot of gold. There's just one tiny thing standing in his way: a 21-inch leprechaun named King Brian. In order to get the gold, Darby must match his wits against the shrewd little trickster -- which proves no small task, indeed! Fall under the spell of DARBY O'GILL AND THE LITTLE PEOPLE for a fun-filled evening of magic, mirth, and nonstop shenanigans!
0052738::::The Diary of Anne Frank::::1959-03-18::::http://image.tmdb.org/t/p/w500//9oBQj09CuLQmxMeQugXk35TNAYg.jpg::::The true, harrowing story of a young Jewish girl who, with her family and their friends, is forced into hiding in an attic in Nazi-occupied Amsterdam.
0052771::::Edge of Eternity::::1959-11-02::::http://image.tmdb.org/t/p/w500//hSGbRoMcuALxzKp0j4hiC64SMBK.jpg::::Helped by socialite Janice Kendon and barkeeper Scott O'Brien, Arizona deputy sheriff Les Martin works to solve three brutal murders in and around the Grand Canyon. His efforts leads to the killer fleeing with Janice as a hostage and a chase by car and helicopter lead to a climax on a miner's bucket on cables a mile above the canyon floor.
0052905::::The Hound of the Baskervilles::::1939-03-24::::http://image.tmdb.org/t/p/w500//pCMXv6iSYFnbnT9VR6iuoVuMJat.jpg::::On his uncle's death Sir Henry Baskerville returns from Canada to take charge of his ancestral hall on the desolate moors of Devonshire, and finds that Sherlock Holmes is there to investigate the local belief that his uncle was killed by a monster hound that has roamed the moors since 1650, and is likely to strike again at Sir Henry.
0052918::::Imitation of Life::::1959-04-30::::http://image.tmdb.org/t/p/w500//xt3cUn7lsjpaGuB279A4v8zAYRn.jpg::::Lora Meredith, a white widow who dreams of being on Broadway, has a chance encounter with Annie Johnson, a black single mother. Annie becomes the caretaker of Lora's daughter, Susie, while Lora pursues her stage career. Both women deal with the difficulties of motherhood: Lora's thirst for fame threatens her relationship with Susie, while Annie's light-skinned daughter, Sarah Jane, struggles with her African-American identity.
0052948::::Journey to the Center of the Earth::::2008-07-10::::http://image.tmdb.org/t/p/w500//myhj05hTAcQL2rhOrMqWxiioo49.jpg::::On a quest to find out what happened to his missing brother, a scientist, his nephew and their mountain guide discover a fantastic and dangerous lost world in the center of the earth.
0052997::::The League of Gentlemen::::1960-04-05::::http://image.tmdb.org/t/p/w500//vZD7HmjzWSrboyxDkotvW5tFINs.jpg::::Involuntarily-retired Colonel Hyde recruits seven other dissatisfied ex-servicemen for a special project. Each of the men has a skeleton in the cupboard, is short of money, and is a service-trained expert in his field. The job is a bank robbery, and military discipline and planning are imposed by Hyde and second-in-command Race on the team, although civilian irritations do start getting in the way.
0053002::::Dangerous Liaisons::::1959-09-09::::http://image.tmdb.org/t/p/w500//zc68mhNgXEiXZObbNvQ6MvIk9rf.jpg::::Juliette Merteuil and Valmont is a sophisticated couple, always looking for fun and excitement. Both have sexual affairs with others and share their experiences with one another. But there is one rule: never fall in love. But this time Valmont falls madly in love with a girl he meets at a ski resort, Marianne.
0053084::::The Mouse That Roared::::1959-07-17::::http://image.tmdb.org/t/p/w500//kfUyKFNZ5yuSOThdVWRMpl2SWpJ.jpg::::The Duchy of Grand Fenwick decides that the only way to get out of their economic woes is to declare war on the United States, lose and accept foreign aid. They send an invasion force to New York (armed with longbows) which arrives during a nuclear drill that has cleared the streets.
0053112::::The Night We Dropped a Clanger::::1959-10-10::::http://image.tmdb.org/t/p/w500//jraewn2ySglRsHnt5bXunEIZzsS.jpg::::The movie takes place during WWII.  A dashing British RAF Officer is earmarked for a secret mission behind enemy lines in occupied France, but wishing to distract the enemy, enlists a person to double for him and thereby draw attention to North Africa . An unlikely airman is found and tutored in the ways of an English officer.
0053126::::North West Frontier::::1959-10-13::::http://image.tmdb.org/t/p/w500//oGbyLFmikSIga4hFhQwyqmTD54r.jpg::::In the rebellious northern frontier province of colonial India, British Army Captain Scott (Kenneth More), a young prince and the boy's governess (Lauren Bacall) escape by an obsolete train as they are relentlessly pursued by Muslim rebels intent on assassinating the prince.
0053131::::The Nun's Story::::1959-06-18::::http://image.tmdb.org/t/p/w500//3NfjFEnVFi0WPIa9iZ7NPQme9VM.jpg::::After leaving a wealthy Belgian family to become a nun, Sister Luke struggles with her devotion to her vows during crisis, disappointment, and World War II.
0053247::::The Scapegoat::::2012-09-09::::http://image.tmdb.org/t/p/w500//o5vlu1HxRQZoaITWwBWB3175gtF.jpg::::Set in 1952, as England prepares for the coronation, The Scapegoat tells the story of two very different men who have one thing in common - a face.
0053285::::Sleeping Beauty::::1959-02-17::::http://image.tmdb.org/t/p/w500//hsQD3U3P8wkU63jgKg9TlK5oxK3.jpg::::A beautiful princess born in a faraway kingdom is destined by a terrible curse to prick her finger on the spindle of a spinning wheel and fall into a deep sleep that can only be awakened by true love's first kiss. Determined to protect her, her parents ask three fairies to raise her in hiding. But the evil Maleficent is just as determined to seal the princess's fate.
0053318::::Suddenly, Last Summer::::1959-12-22::::http://image.tmdb.org/t/p/w500//mGRm6MmDqIkpjRUvH9aWZBxvyLg.jpg::::The only son of wealthy widow Violet Venable dies while on vacation with his cousin Catherine. What the girl saw was so horrible that she went insane; now Mrs. Venable wants Catherine lobotomized to cover up the truth.
0053320::::A Summer Place::::1959-11-18::::http://image.tmdb.org/t/p/w500//escHRIldvNphvBnxMcn6ybaJId0.jpg::::A self-made businessman rekindles a romance with a former flame while their two teenage children begin a romance of their own with drastic consequences for both couples.
0053719::::The City of the Dead::::1960-09-09::::http://image.tmdb.org/t/p/w500//deklb4Yh1pdQC7zIK325S5HlyuE.jpg::::A young college student arrives in a sleepy Massachusetts town to research witchcraft; during her stay at an eerie inn, she discovers a startling secret about the town and its inhabitants.
0053796::::The Entertainer::::1960-07-25::::http://image.tmdb.org/t/p/w500//mE8xsdCNlF5GoSrWlmQzu4zwotM.jpg::::Archie Rice, an old-time British vaudeville performer sinking into final defeat, schemes to stay in show business.
0053810::::The Facts of Life::::1960-11-14::::http://image.tmdb.org/t/p/w500//xw4CamBEf9P6JyFs5dSnHsq9SLX.jpg::::Middle-class suburbanites Larry and Kitty grow bored with their lives and respective marriages. Although each always found the other's manner grating, they fall in love when thrown together--without their spouses--on vacation. On returning home they try to break things off, only to grow closer. A holiday together will finally settle whether they should end their marriages.
0053925::::House of Usher::::1960-06-21::::http://image.tmdb.org/t/p/w500//jEzZOrGSWpl0jKOIXoY3OnEabLQ.jpg::::After a long journey, Philip arrives at the Usher mansion seeking his loved one, Madeline. Upon arriving, however, he discovers that Madeline and her brother Roderick Usher have been afflicted with a mysterious malady: Roderick's senses have become painfully acute, while Madeline has become catatonic. That evening, Roderick tells his guest of an old Usher family curse: any time there has been more than one Usher child, all of the siblings have gone insane and died horrible deaths. As the days wear on, the effects of the curse reach their terrifying climax.
0053944::::The Incredible Petrified World::::1959-11-18::::http://image.tmdb.org/t/p/w500//qns5oUzhUTGcPyeNyaM3DwBrwdC.jpg::::When the cable breaks on their diving bell four people find themselves trapped in a hidden underwater world.
0053946::::Inherit the Wind::::1960-06-24::::http://image.tmdb.org/t/p/w500//7oaHcF0gCOt2lKaT2zajhajP0Zo.jpg::::This gripping adaptation of the Jerome Lawrence-Robert E. Lee play examines an issue that still causes great controversy—the role religion should play in the schools.
0054029::::Light Up the Sky!::::1960-07-05::::http://image.tmdb.org/t/p/w500//io4Tp4s74ZaN0mjhEgLQxr4FLbo.jpg::::Lewis Gilbert's classic comedy drama portrays the antics of a British Army Searchlight Squad during World War II. Lieutenant Ogleby (Ian Carmichael) has his work cut out to keep his "legionnaires" at their post and not rampaging through the local countryside. The McGaffey brothers (Benny Hill and Tommy Steele) create havoc with their light-fingers and light-loving with the local girls, whilst Smithy (Johnny Briggs) pines for his sweetheart.
0054038::::The Lost World::::2001-12-25::::http://image.tmdb.org/t/p/w500//22PtJeHtI19j15nkQiM561Ng7cH.jpg::::This Lost World is a splendid BBC TV dramatisation of Sir Arthur Conan Doyle's famous adventure story. Bob Hoskins makes an unusually genial Professor Challenger, far less of a bully than Doyle's character, but his slightly stereotyped companions are nicely filled out by a solid cast. James Fox is Challenger's more timid but still covertly adventurous rival, Tom Ward is the moustachioed big game hunter who faces an Allosaurus with an elephant gun, and Matthew Rhys plays the tagalong reporter hoping to impress his faithless fiancée.
0054152::::Our Man in Havana::::1959-12-30::::http://image.tmdb.org/t/p/w500//8zSmdJ1DewyvjV2oYdcL1sqLLGa.jpg::::Is a light hearted and satirical tale of political espionage and intrigue in pre-Castro Cuba.
0054188::::Please Don't Eat the Daisies::::1960-03-31::::http://image.tmdb.org/t/p/w500//neSCV9m8R1ykTqicd53fdwQgQnJ.jpg::::Drama critic Larry Mackay, his wife Kate and their four sons move from their crowded Manhattan apartment to an old house in the country. While housewife Kate settles into suburban life, Larry continues to enjoy the theater and party scene of New York.
0054269::::Saturday Night and Sunday Morning::::1960-10-27::::http://image.tmdb.org/t/p/w500//fHHKxB71EzVzny3ZakxZRGe5Evw.jpg::::A 22-year-old factory worker lets loose on the weekends: drinking, brawling, and dating two women, one of whom is older and married.
