25::::The Oxford and Cambridge University Boat Race::::1895-03-30::::https://m.media-amazon.com/images/M/MV5BOGFiZjVkYmYtYjkwZC00NWY0LWI0MGItYWYyNzNlMDNlN2Y2XkEyXkFqcGdeQXVyNzg5OTk2OA@@._V1_.jpg::::Although the content of this film is primitive in the extreme - a shot of the traditional Oxford versus Cambridge University Boat Race, filmed on March 30 1895 - this film is of immense historical importance as being the first ever British film
0000439::::The Great Train Robbery::::1903-12-07::::http://image.tmdb.org/t/p/w500//uf7Hr1wuUh4T83Ifg5pVpwTqRdI.jpg::::The clerk at the train station is assaulted and left tied by four men, then they rob the train threatening the operator. (They) take all the money and shoot a passenger when trying to run away. A little girl discovers the clerk tied and gives notice to the sheriff, who at once goes along with his men hunting the bandits.
0000833::::The Country Doctor::::1909-07-08::::http://image.tmdb.org/t/p/w500//4KJwv04mL75obYBWqNx5fSTiB2J.jpg::::While caring for his sick daughter, a doctor is called away to the sickbed of a neighbor. He finds the neighbor gravely ill, and ignores his wife's pleas to come home and care for his own daughter, who has taken a turn for the worse.
0001223::::Frankenstein::::1931-11-21::::http://image.tmdb.org/t/p/w500//jFpc9w3RmYeaOXMEfrtgshwVf4u.jpg::::Dr Henry Frankenstein is obsessed with assembling a living being from parts of several exhumed corpses.
0004099::::His Majesty, the Scarecrow of Oz::::1914-10-14::::http://image.tmdb.org/t/p/w500//poyIlUHUa95yFgqFnuKEjXOHRcW.jpg::::A wicked king has taken over the Emerald City, and wants his daughter, Princess Gloria to marry the horrid courtier Googly-Goo, though she loves Pon, the Gardener's Boy. The camera follows two farmers placing a Scarecrow upon a pole in a cornfield. Pon rescues a Kansas girl named Dorothy from the evil witch Mombi, whom Princess Gloria has been taken to by King Krewl to freeze her heart so she will no longer love Pon. An Indian princess has a ceremony to bring the Scarecrow to life. Pon rescues the cold-hearted princess and they flee for help, discovering the Scarecrow, who promptly falls in love with the princess, and Button-Bright, a lost boy from America. They come to the castle of the Tin Emperor, Nick Chopper, and after oiling him, he falls in love with Gloria. After a bit of a chase aided by the Sawhorse and the Wizard, Mombi turns Pon into a Kangaroo, and a slough of Fred Woodward's animals battle it out.
0004457::::The Patchwork Girl of Oz::::1914-09-28::::https://m.media-amazon.com/images/M/MV5BMTc1NzUyMjg0MV5BMl5BanBnXkFtZTYwNzAzMjI5._V1_.jpg::::Ojo and Unc Nunkie are out of food, so they decide to journey to the Emerald City where they will never starve. Along the way, they meet Mewel, a waif and stray (mule) who leads them to Dr. Pipt, who has been stirring the powder of life for nine years. Ojo adds plenty of brains to Margolotte's Patchwork servant before she is brought to life with the powder. When Scraps does come to life, she accidentally knocks the liquid of petrifaction upon Unc Nunkie, Margolotte, and Danx (daughter Jesseva's boyfriend). So all go on separate journeys to find the ingredients to the antidote. (Of course Jesseva has Danx shrunken to take with her, which causes trouble with Jinjur.) Of course, no one ever told Ojo that some of the ingredients were illegal to obtain...
0006437::::The Blacklist (1916)::::1916-02-20::::https://m.media-amazon.com/images/M/MV5BNGNmYTcwNTItMGQxYS00NTgwLTkxYTgtZTg5Y2Q5MGM3N2ZlXkEyXkFqcGdeQXVyNjA5MTAzODY@._V1_.jpg::::Based on the 1915 Colorado miners strike. Warren Harcourt, the coal company manager, comes to the scene. This causes a chain of events that will change the current status quo.
0008133::::The Immigrant::::2013-07-03::::http://image.tmdb.org/t/p/w500//dH9al9Xvsvtmq7LbpafFIY9ZcMZ.jpg::::1921 New York. An immigrant woman is tricked into a life of burlesque and vaudeville until a dazzling magician tries to save her and reunite her with her sister who is being held in the confines of Ellis Island.
0009678::::Take a Chance (1918)::::1918-12-15::::https://m.media-amazon.com/images/M/MV5BZTg0NjYxOWMtNWM3My00YTY3LWJlYjctY2I0M2ZlNDU2Y2MyXkEyXkFqcGdeQXVyMjUxODE0MDY@._V1_.jpg::::A carefree young man who just "spent" the last dime in his pocket comes across a young woman just hired to clean the front steps of a house. They meet when the young man first meets her bar of soap. While they are attracted to each other, she is already going on a date with Simplex Joe. The carefree young man decides to follow the pair on their date to a park where they will be picnicking. What happens with this love triangle is affected by other picnickers at the park, including an amorous woman unlucky in love, and the police chasing after a pair of escaped convicts from a local prison.
0011130::::Dr. Jekyll and Mr. Hyde::::1941-08-12::::http://image.tmdb.org/t/p/w500//2GDdW84XSX3BYMJ9tmnFkZOGJyB.jpg::::Dr. Jekyll believes good and evil exist in everyone and creates a potion that allows his evil side, Mr. Hyde, to come to the fore. He faces horrible consequences when he lets his dark side run amok.
0011439::::The Mark of Zorro::::1940-11-08::::http://image.tmdb.org/t/p/w500//ahmBBQHINkGpgnxnuBIfzUC9mkL.jpg::::Around 1820 the son of a California nobleman comes home from Spain to find his native land under a villainous dictatorship. On the one hand he plays the useless fop, while on the other he is the masked avenger Zorro.
0011656::::The Scarecrow::::1920-11-07::::http://image.tmdb.org/t/p/w500//vgLAIygLfSeRcP2x9RMsxD7GddJ.jpg::::Buster competes with another farmhand for the love of the farmer's daughter.
0011717::::The Son of Tarzan::::1920-04-30::::http://image.tmdb.org/t/p/w500//b50p6GnUE7ywuvABb9YLCLlEhN7.jpg::::Tarzan's son Jack is kidnapped from England by his old enemy Paulovich. Jack escapes into the African jungle where he meets Meriem, a European girl held captive. Freeing her, he falls in love but she's sought by Paulovich. Then Tarzan arrives with Jane to save the day!
0014142::::The Hunchback of Notre Dame::::1996-06-21::::http://image.tmdb.org/t/p/w500//r7V92gY3AMO6li17MmGTixAnFcv.jpg::::When Quasimodo defies the evil Frollo and ventures out to the Festival of Fools, the cruel crowd jeers him. Rescued by fellow outcast the gypsy Esmeralda, Quasi soon finds himself battling to save the people and the city he loves.
0014532::::The Ten Commandments::::1956-10-05::::http://image.tmdb.org/t/p/w500//3Ei59AR64x6dMZfWobPCkZjbqTL.jpg::::Escaping death, a Hebrew infant is raised in a royal household to become a prince. Upon discovery of his true heritage, Moses embarks on a personal quest to reclaim his destiny as the leader and liberator of the Hebrew people.
0015016::::The Iron Horse::::1924-08-24::::http://image.tmdb.org/t/p/w500//bHKKddjh7fmOAsMxeKL3cplugFT.jpg::::Brandon, a surveyor, dreams of building a railway to the west. He sets off with his son, Davy, to survey a route. They discover a new pass which will shave 200 miles off the expected distance, but they are set upon by a party of Cheyenne. One of them, a white renegade with only two fingers on his right hand, kills Brandon and scalps him. Davy is all alone now.
0015163::::The Navigator::::1924-10-13::::http://image.tmdb.org/t/p/w500//Av9JzUEpVw7N1HWrBd2s84oxcS2.jpg::::The wealthy and impulsive Rollo Treadway decides to propose to his beautiful socialite neighbor, Betsy O'Brien. Although Betsy turns Rollo down, he still opts to go on the cruise that he intended as their honeymoon. When circumstances find both Rollo and Betsy on the wrong ship, they end up having adventures on the high seas.
0015400::::The Thief of Bagdad::::1940-12-25::::http://image.tmdb.org/t/p/w500//gK0509vSPLYx8dz67QUHMtqs3k6.jpg::::When Prince Ahmad is blinded and cast out of Bagdad by the nefarious Jaffar, he joins forces with the scrappy thief Abu to win back his royal place, as well as the heart of a beautiful princess.
0016039::::The Lost World::::2001-12-25::::http://image.tmdb.org/t/p/w500//22PtJeHtI19j15nkQiM561Ng7cH.jpg::::This Lost World is a splendid BBC TV dramatisation of Sir Arthur Conan Doyle's famous adventure story. Bob Hoskins makes an unusually genial Professor Challenger, far less of a bully than Doyle's character, but his slightly stereotyped companions are nicely filled out by a solid cast. James Fox is Challenger's more timid but still covertly adventurous rival, Tom Ward is the moustachioed big game hunter who faces an Allosaurus with an elephant gun, and Matthew Rhys plays the tagalong reporter hoping to impress his faithless fiancée.
0016220::::The Phantom of the Opera::::2004-12-08::::http://image.tmdb.org/t/p/w500//aTsp2VTaCBiGs8w05OTXfD97FRZ.jpg::::Deformed since birth, a bitter man known only as the Phantom lives in the sewers underneath the Paris Opera House. He falls in love with the obscure chorus singer Christine, and privately tutors her while terrorizing the rest of the opera house and demanding Christine be given lead roles. Things get worse when Christine meets back up with her childhood acquaintance Raoul and the two fall in love
0016230::::The Pleasure Garden::::1925-11-03::::http://image.tmdb.org/t/p/w500//DpCDqbyxBlSChWTCx42n4WA8BX.jpg::::Patsy Brand is a chorus girl at the Pleasure Garden music hall. She meets Jill Cheyne who is down on her luck and gets her a job as a dancer. Jill meets adventurer Hugh Fielding and they get engaged, but when Hugh travels out of the country, she begins to play around.
0016361::::Smouldering Fires::::1925-01-18::::http://image.tmdb.org/t/p/w500//aF4bHDgG3MSwbdR5IBsZA3tP0cO.jpg::::A successful businesswoman falls in love with one of her (much younger) factory workers. She doesn't know that he is in love with her younger sister.
0016544::::The Wizard of Oz::::1939-08-15::::http://image.tmdb.org/t/p/w500//AvfTP1muzUQ0gWCEAj4hlkTOCtc.jpg::::Young Dorothy finds herself in a magical world where she makes friends with a lion, a scarecrow and a tin man as they make their way along the yellow brick road to talk with the Wizard and ask for the things they miss most in their lives. The Wicked Witch of the West is the only thing that could stop them.
0016747::::Crazy Like a Fox::::1926-08-26::::http://image.tmdb.org/t/p/w500//1JA5UaOWSgIUTYeCZzNdXyacWEG.jpg::::Two rich capitalists want to marry their children, but they don't like the idea at all. She tries to run away, and meets him at the station. They fall in love, unbeknownst to their real identities, and decide each on their own that they have to wreck their parents plan.
0017075::::The Lodger: A Story of the London Fog::::1927-02-14::::http://image.tmdb.org/t/p/w500//nnJNa1MwLatWc9phWvZ6AYZjeaC.jpg::::London. A mysterious serial killer brutally murders young blond women by stalking them in the night fog. One foggy, sinister night, a young man who claims his name is Jonathan Drew arrives at the guest house run by the Bunting family and rents a room.
0017350::::The Scarlet Letter::::1995-10-13::::http://image.tmdb.org/t/p/w500//1qn64QSxt32c7pTxtSZQGNRc97R.jpg::::Set in puritanical Boston in the mid 1600s, the story of seamstress Hester Prynne, who is outcast after she becomes pregnant by a respected reverend. She refuses to divulge the name of the father, is "convicted" of adultery and forced to wear a scarlet "A" until an Indian attack unites the Puritans and leads to a reevaluation of their laws and morals.
0017739::::The Cat and the Canary::::1939-10-27::::http://image.tmdb.org/t/p/w500//km6O2VH2UEhVktOpaTosfTflL3n.jpg::::Ten years after the death of millionaire Cyrus Norman, his will is to be read out to his six relatives, including Joyce Norman and Wally Campbell. Organized by Norman's lawyer, Crosby, the six meet at Norman's eerie New Orleans Gothic mansion. During the reading, the superstitious housekeeper declares that someone will be dead by midnight. Wally fears for Joyce when she is declared the sole inheritor, but all are alarmed when Crosby turns up dead.
0017841::::East Side, West Side::::1949-12-22::::http://image.tmdb.org/t/p/w500//gEH2YneIDzIFolOxs7SN1SYn3N8.jpg::::A New Yorker's (James Mason) mistress (Ava Gardner) drives his wife (Barbara Stanwyck) to a war hero; then someone kills the mistress.
0018455::::Sunrise: A Song of Two Humans::::1927-11-04::::http://image.tmdb.org/t/p/w500//tyxjxpwr9NiVtSeITtVXuhp84Zl.jpg::::A married farmer falls under the spell of a slatternly woman from the city, who tries to convince him to drown his wife.
0018471::::Tell It to the Marines::::1926-12-23::::http://image.tmdb.org/t/p/w500//wX8Q8otMiIHGRDETwFLMqZaGVCL.jpg::::U.S. Marine Sergeant O'Hara has his hands full training raw recruits, one of whom, 'Skeets' Burns, is a particular thorn in his side. If Burns's lackadaisical approach to the military were not bad enough, he also makes advances on nurse Nora Dale, whom Sergeant O'Hara secretly loves. Nora is oblivious to O'Hara's feelings and is attracted to the handsome 'Skeet.' But an indiscretion turns her against him, and it takes an expedition to China and a battle with a warlord's bandit brigade to sort things out among the nurse and her two Marines.
0019071::::The Last Command::::1928-01-21::::http://image.tmdb.org/t/p/w500//8ReC6DzKvaNW3eClavTg8hRnt9l.jpg::::A former Imperial Russian general and cousin of the Czar ends up in Hollywood as an extra in a movie directed by a former revolutionary.
0019130::::The Man Who Laughs::::1928-04-27::::http://image.tmdb.org/t/p/w500//m79FfxGQtlvVLQkLXaeeqZgedPW.jpg::::Gwynplaine, son of Lord Clancharlie, has a permanent smile carved on his face by the King, in revenge for Gwynplaine's father's treachery. Gwynplaine is adopted by a travelling showman and becomes a popular idol. He falls in love with the blind Dea. The king dies, and his evil jester tries to destroy or corrupt Gwynplaine.
0019195::::The Mysterious Lady::::1928-08-04::::http://image.tmdb.org/t/p/w500//16sRc7zeJNYqxbgOYxmlkDkgDyP.jpg::::A beautiful Russian spy seduces an Austrian military officer in order to obtain secret plans. When she falls in love with him, both are placed in danger.
0020487::::That's My Wife::::1929-03-23::::http://image.tmdb.org/t/p/w500//guHlQQG5ctQha0vmTj1pxfKbulU.jpg::::Oliver stands to inherit a large fortune from his rich Uncle Bernal, with the condition that he be happily married. But when Mrs. Hardy walks out just before Uncle Bernal is due for a visit, Stanley is pressed into duty (and into drag) to impersonate Oliver's loving spouse.
0020629::::All Quiet on the Western Front::::1979-11-14::::http://image.tmdb.org/t/p/w500//2HHFfieloWJcIz5PU3NKrv1i6DJ.jpg::::At the start of World War I, Paul Baumer is a young German patriot, eager to fight. Indoctrinated with propaganda at school, he and his friends eagerly sign up for the army soon after graduation. But when the horrors of war soon become too much to bear, and as his friends die or become gravely wounded, Paul questions the sanity of fighting over a few hundreds yards of war-torn countryside.
0020640::::Animal Crackers::::2017-06-12::::http://image.tmdb.org/t/p/w500//rj5X6Ez0rIkoiVsU4JlNHpDnpJn.jpg::::A family must use a magical box of Animal Crackers to save a rundown circus from being taken over by their evil uncle Horatio P. Huntington.
0020686::::The Big House::::1930-06-14::::http://image.tmdb.org/t/p/w500//xiFsHEaBpYozpylj9ojH7YV2rX3.jpg::::Convicted of manslaughter for a drunken driving accident, Kent Marlowe is sent to prison, where he meets vicious incarcerated figures who are planning an escape from the brutal conditions.
0020693::::Pat Garrett & Billy the Kid::::1973-05-23::::http://image.tmdb.org/t/p/w500//gHzwIPDCgTjxCd8giXXqJqFm178.jpg::::An aging Pat Garrett is hired as a lawman on behalf of a group of wealthy New Mexico cattle barons--his sole purpose being to bring down his old friend Billy the Kid.
0020902::::Free and Easy::::1930-03-22::::http://image.tmdb.org/t/p/w500//31UrsNkQOBNgaGkE7FF8oD6ONU.jpg::::Gopher City Kansas hosts a beauty contest. The winner, Elvira Plunkett, and her mother go to Hollywood. The Chamber of Commerce also provides Elvira with an agent, Gopher City's own Elmer J. Butz. Elmer likes Elvira and the shy Elvira likes him, but Mrs. Plunkett, a formidable woman, has little use for hapless Elmer. On the train west, they meet movie star Larry Mitchell, who takes a shine to Elvira and helps her meet MGM directors once they get to Tinsel Town. Elmer, meanwhile, wants to help Elvira with her career and he also wants to be her man. Movie stardom does come to the Gopher City entourage, but to whom is a surprise. And who will win the lovely Elvira's hand?
0020960::::Hell's Angels::::1930-11-15::::http://image.tmdb.org/t/p/w500//bBHriR8WezriiljbibU0g78h6E1.jpg::::In this aerial spectacle, brothers Roy and Monte Rutledge, each attending Oxford university, enlist with the Royal Flying Corps when World War I breaks out.
0020987::::Hook, Line and Sinker::::1930-12-26::::http://image.tmdb.org/t/p/w500//ekIyyD50bYKzfVQt5XUIfgAtylS.jpg::::Two fast-talking insurance salesmen meet Mary, who is running away from her wealthy mother, and they agree to help her run a hotel that she owns. When they find out that the hotel is run down and nearly abandoned, they launch a phony PR campaign that presents the hotel as a resort favored by the rich. Their advertising succeeds too well, and many complications soon arise.
0021013::::Journey's End::::2017-12-14::::http://image.tmdb.org/t/p/w500//5gGkt84bCPt7XRo35FcsrOeer78.jpg::::Set in a dugout in Aisne in 1918, a group of British officers, led by the mentally disintegrating young officer Stanhope, variously await their fate.
0021054::::The Laurel-Hardy Murder Case::::1930-09-06::::http://image.tmdb.org/t/p/w500//blQOWaHr7t0M64YWZaG75Pa3TkK.jpg::::The boys think their days of fishing to feed themselves have come to an end, when Stan's rich uncle Ebenezer dies leaving a large estate. But they soon learn that Ebenezer was murdered and all the relatives, including Stan, are suspects. This is the first film where Oliver says "Here's Another 'Nice' Mess You've Gotten Me Into". The phrase is commonly misquoted as "Here's Another 'Fine' Mess You've Gotten Me Into" and has passed into everyday language usage.
0021079::::Little Caesar::::1931-01-25::::http://image.tmdb.org/t/p/w500//9TSzQm3aE7FdnutXIGmHc3G4llE.jpg::::A small-time hood shoots his way to the top, but how long can he stay there?
0021890::::The Front Page::::1974-12-01::::http://image.tmdb.org/t/p/w500//r4RtbJk8wVyZ1yk6yBZjzGD4ANU.jpg::::A journalist suffering from burn-out wants to finally say goodbye to his office – but his boss doesn’t like the idea one bit.
0022158::::Monkey Business::::1931-09-19::::http://image.tmdb.org/t/p/w500//9iZpFKpp6ZaTahbprypM7ek4HVt.jpg::::Four stowaways get mixed up with gangsters while running riot on an ocean liner.
0022279::::Private Lives::::1931-12-12::::http://image.tmdb.org/t/p/w500//gilIJktT1s3GOyvl1XStOSrcGZN.jpg::::Amanda and Elyot are one another's former spouse. Elyot remarries to Sibyl, Amanda weds Victor. Unexpectedly, both honeymooning couples arrive to a hotel on the same day and are put in rooms with adjoining terraces. Things go well until Amanda sees Elyot on the adjacent terrace.
0022395::::The Skin Game::::1931-02-26::::http://image.tmdb.org/t/p/w500//5B59phyjnDcm25LFVJgAmQD19xo.jpg::::An old traditional family and a modern family battle over land in a small English village and almost destroy each other.
0022458::::Tabu::::1931-08-01::::http://image.tmdb.org/t/p/w500//inP5bLWg3VhLlEYh5gvpkW90aOf.jpg::::The youngsters Matahi and Reri are in love with each other. The old warrior Hitu announces that Reri is to be the new chosen virgin for the gods. This means she must stay untouched, otherwise she and her lover will be killed. But Matahi abducts and escapes with her to an island ruled by the white man, where their gods would be harmless and powerless. Tabu is the last film from director F.W. Murnau; he died before the film’s premiere in a car accident.
0022778::::The Conquerors::::1932-11-18::::http://image.tmdb.org/t/p/w500//nh9bKNDtMbOQVM8OZpK6PAdQ6eM.jpg::::A newlywed couple journeys west to make their fortune, and begins a banking empire.
0022782::::County Hospital::::1932-06-25::::http://image.tmdb.org/t/p/w500//7Z75BPxPWkTAYiBmuH40Wv9EU9d.jpg::::Ollie is in the hospital with a broken leg. When Stan comes to visit him, total chaos ensues.
0022792::::The Crowd Roars::::1932-04-13::::http://image.tmdb.org/t/p/w500//gRUMnBQORESUXafyDs4snpeLnqG.jpg::::Famous motor-racing champion Joe Greer returns to his hometown to compete in a local race. He discovers his younger brother has aspirations to become a racing champion, and during the race Joe loses his nerve when another driver is killed, leaving his brother to win. Joe's luck takes a plunge whilst his brother rises to height of fame.
0022835::::Dr. Jekyll and Mr. Hyde::::1941-08-12::::http://image.tmdb.org/t/p/w500//2GDdW84XSX3BYMJ9tmnFkZOGJyB.jpg::::Dr. Jekyll believes good and evil exist in everyone and creates a potion that allows his evil side, Mr. Hyde, to come to the fore. He faces horrible consequences when he lets his dark side run amok.
0022879::::A Farewell to Arms::::1932-12-08::::http://image.tmdb.org/t/p/w500//eNmPByGZJqlp60nCZRhsAlVAb3F.jpg::::A tale of the World War I love affair, begun in Italy, between American ambulance driver Lt. Frederic Henry and British nurse Catherine Barkley. Eventually separated by Frederic's transfer, tremendous challenges and difficult decisions face each as the war rages on.
0022883::::The Fatal Glass of Beer::::1933-03-03::::http://image.tmdb.org/t/p/w500//2uqaq0TtsWhdf6baUfeBoQim5DL.jpg::::The prodigal son of a Yukon prospector comes home on a night that "ain't fit for man nor beast."
0023042::::I Am a Fugitive from a Chain Gang::::1932-11-09::::http://image.tmdb.org/t/p/w500//2ibVcaVJ13dlg98C52D8mkPKgdq.jpg::::A World War I veteran’s dreams of becoming a master architect evaporate in the cold light of economic realities. Things get even worse when he’s falsely convicted of a crime and sent to work on a chain gang.
0023238::::The Most Dangerous Game::::1932-09-16::::http://image.tmdb.org/t/p/w500//3aNlOIFlGOnIzxqvAWpgm5Sly1H.jpg::::When legendary hunter Bob Rainsford is shipwrecked on the perilous reefs surrounding a mysterious island, he finds himself the guest of the reclusive and eccentric Count Zaroff. While he is very gracious at first, Zaroff eventually forces Rainsford and two other shipwreck survivors, brother and sister Eve and Martin Towbridge, to participate in a sadistic game of cat and mouse in which they are the prey and he is the hunter.
0023249::::Murders in the Rue Morgue::::1971-07-21::::http://image.tmdb.org/t/p/w500//p0GHGWN3zrcA47hwBeucKiMfDWI.jpg::::In Paris, in the beginning of the Twentieth Century, Cesar Charron owns a theater at the Rue Morgue where he performs the play "Murders in the Rue Morgue" with his wife Madeleine Charron, who has dreadful nightmares. When there are several murders by acid of people connected to Cesar, the prime suspect of Inspector Vidocq would be Cesar's former partner Rene Marot. But Marot murdered Madeleine's mother many years ago and committed suicide immediately after.
0023266::::Night After Night::::1932-10-30::::http://image.tmdb.org/t/p/w500//6inArfeANunvk6YIvWEu4fmS5Po.jpg::::A former boxer purchases a classy speakeasy and falls in love with a wealthy society girl.
0023302::::Once in a Lifetime::::1932-10-02::::http://image.tmdb.org/t/p/w500//AlJcB1atZSA4RbnTxckAofOhxnY.jpg::::Story of a Hollywood studio during the transition from silents to talkies.
0023312::::Pack Up Your Troubles::::1932-09-16::::http://image.tmdb.org/t/p/w500//nebJfaT9ZzDMzqz7uat7AUfCvGF.jpg::::The story begins in 1917 with Stan and Ollie being drafted into the U.S. Army to fight in World War I. While in the Army, the pair befriend a man named Eddie Smith, who is killed by the enemy during a battle. After the war is over, Stan and Ollie venture to New York City, where they begin a quest to reunite Eddie's little daughter with her rightful family. The task proves both monumental and problematic as the boys discover just how many people in New York have the last name Smith.
0023349::::Polly of the Circus::::1932-02-27::::http://image.tmdb.org/t/p/w500//cJAwDzu168w2s98YoHgKloIvg4F.jpg::::When Polly Fisher, a circus aerialist, is hurt while performing, she is taken to the house of a nearby minister, John Hartley. As she recuperates, they fall in love with each other and secretly marry. But when the truth leaks out , John's congregation rebels at having a circus woman as their minister's wife, and he is fired. Polly decides to leave John in hopes of giving back to him the calling that means so much to him. But fate steps in and rearranges all plans.
0023458::::Shanghai Express::::1932-02-03::::http://image.tmdb.org/t/p/w500//a7RorsrpQvQxVSzzyJiFT06NH6S.jpg::::A beautiful temptress re-kindles an old romance while trying to escape her past during a tension-packed train journey.
0023622::::Trouble in Paradise::::1932-10-30::::http://image.tmdb.org/t/p/w500//FBxuoLRD3Biyul14unT5m3PYNS.jpg::::Thief Gaston Monescu and pickpocket Lily are partners in crime and love. Working for perfume company executive Mariette Colet, the two crooks decide to combine their criminal talents to rob their employer. Under the alias of Monsieur Laval, Gaston uses his position as Mariette's personal secretary to become closer to her. However, he takes things too far when he actually falls in love with Mariette, and has to choose between her and Lily.
0023640::::Eerie Tales::::1919-11-05::::http://image.tmdb.org/t/p/w500//qmdzebNUkg63nuzCtQ79Y4pzSHP.jpg::::After the old-books shop closes, portraits of the Strumpet, Death, and the Devil come to life and amuse themselves by reading stories--about themselves.
